x,y,quote
511320,80,Arbeiter wöchentlich 60000 Stunden lebendiger Arbeit wovon 30 000 Stunden
511339,88,700 nur 1A soviel lebendige Arbeit und daher auch nur
511348,103,nur 1A soviel Mehr 1A arbeit in Bewegung setzen wie
511408,67,Massen in Bewegung gesetzter lebendiger Arbeit die Massen der producirten
511465,43,10 und brauchen also 100 Arbeiter wöchentlich um dasselbe Quantum
511591,20,Profit weil es weniger lebendige Arbeit in Bewegung setzt als
511734,20,Arbeitstag und gleichem Exploitationsgrad der Arbeit sehr verschiedne Mengen von
511779,20,ihnen in Bewegung gesetzten lebendigen Arbeit verschieden also auch die
511823,21,des Mehrwerths ist die lebendige Arbeit Bei gleichem Exploitationsgrad der
511828,40,Arbeit Bei gleichem Exploitationsgrad der Arbeit hängt die Masse der
511840,56,Kapital 100 in Bewegung gesetzten Arbeit und daher auch der
511905,30,Quelle haben müßte als die Arbeit und daß damit jede
511926,42,gleich dem 128 Wochenlohn eines Arbeiters für 60 Arbeitsstunden und
511943,54,das Gesammt Werthprodukt das ein Arbeiter in einer Woche liefern
511951,71,Woche liefern kann 2 10 Arbeiter könnten also nicht mehr
512018,38,etwas andres sein als vergegenständlichte Arbeit Da also Kapitale in
512042,48,variables Element ungleich viel lebendige Arbeit in Bewegung setzen und
512374,20,wovon 10 Mehrwerth oder unbezahlte Arbeit darstellt das zweite Produkt
512387,32,wovon 90 Mehrwerth oder unbezahlte Arbeit 20 Es ist dies
512414,43,Mehrwerths 100 d h der Arbeiter arbeite den halben Tag
512415,63,100 d h der Arbeiter arbeite den halben Tag für
512438,70,sie 25 d h der Arbeiter arbeite Vs des Tages
512439,90,25 d h der Arbeiter arbeite Vs des Tages für
512619,20,außer den verschiednen Massen von Arbeit und damit auch bei
512961,20,benutzt Wenn beide gleich viel Arbeit anwenden so werden sie
514019,20,Produktionssphären bei gleichmäßiger Exploitation der Arbeit sehr verschiedne Profitraten entsprechend
514914,20,Größe hat sehr verschiedne Quanta Arbeit von Kapitalen gleicher Größe
515673,20,also Geldausdruck für das Gesammtquantum Arbeit vergangner und neu zugesetzter
516158,20,die in 15 ihnen enthaltne Arbeit aus bezahlter oder unbezahlter
516163,31,Arbeit aus bezahlter oder unbezahlter Arbeit besteht Dies zeigt nur
516249,20,und indirekt als Lebensmittel der Arbeiter auch seinen variablen Theil
516312,20,Werthprodukt der Stundenzahl die der Arbeiter arbeiten muß um die
516313,40,der Stundenzahl die der Arbeiter arbeiten muß um die nothwendigen
517292,20,Entwicklung der gesellschaftlichen Produktivkraft der Arbeit ist in jeder besondren
517313,20,das von einem bestimmten Quantum Arbeit also bei gegebnem Arbeitstag
517322,37,Arbeitstag von einer bestimmten Anzahl Arbeiter in Bewegung gesetzte Quantum
517340,50,bestimmtes Quantum Produktionsmittel erheischte Quantum Arbeit klein ist Wir nennen
517996,20,der in ihr enthaltnen bezahlten Arbeit der Werth auf das
518009,26,ihr enthaltnen bezahlten und unbezahlten Arbeit der Produktionspreis auf die
518017,44,auf die Summe der bezahlten Arbeit plus einem für die
518032,58,selbst bestimmten 40 Quantum unbezahlter Arbeit 166 Neuntes Kapitel Bildung
518119,20,dasselbe Quantum todter und lebendiger Arbeit in ihre Produktion eingeht
518342,20,Kapitals Mehrwerth Den Exploitationsgrad der Arbeit als konstant angenommen kann
518445,20,Waaren wenn der Exploitationsgrad der Arbeit wechselt Oder bei gleichbleibendem
518452,37,Oder bei gleichbleibendem Exploitationsgrad der Arbeit kann die allgemeine Profitrate
518463,53,wenn die Summe der angewandten Arbeit wechselt relativ zum konstanten
518505,49,früher mehr oder minder viel Arbeit erfordern würde Man hat
518802,20,Größen Bei gegebnem Exploitationsgrad der Arbeit ist jetzt die Masse
518928,20,täuschen sondern auch für den Arbeiter Mit der Verwandlung der
519585,20,sei ob es einviertel todte Arbeit und dreiviertel lebendige Arbeit
519589,29,todte Arbeit und dreiviertel lebendige Arbeit oder dreiviertel todte Arbeit
519593,48,lebendige Arbeit oder dreiviertel todte Arbeit und einviertel lebendige Arbeit
519597,68,todte Arbeit und einviertel lebendige Arbeit in Bewegung setzt ob
519622,72,andren bei gleichem Exploitationsgrad der Arbeit und abgesehn von individuellen
519686,42,oder in seinem Zweig beschäftigten Arbeit herstamme Es ist dies
519706,51,ist durch die Gesammtexploitation der Arbeit durch das Gesammtkapital d
519741,52,nicht enthüllt hatten Ersparung an Arbeit nicht nur an der
519746,69,Arbeit nicht nur an der Arbeit nothwendig um ein bestimmtes
519761,81,an der Anzahl der beschäftigten Arbeiter und größre Anwendung todter
519766,100,Arbeiter und größre Anwendung todter Arbeit konstantes Kapital erscheint als
519794,94,Wie sollte daher die lebendige Arbeit ausschließliche Quelle des Profits
519807,103,der zur Produktion nöthigen Menge Arbeit nicht nur nicht den
519952,20,ausmacht fällt mehr oder weniger Arbeit bezahlte und daher auch
519968,34,von der Ausgabe für diese Arbeit größeres oder kleineres Stück
520132,20,B den Wochenlohn von 100 Arbeitern vor Wenn diese 100
520181,20,Wechsel in der Produktionskraft der Arbeit ein sie verdopple sich
520188,38,sie verdopple sich dieselbe Anzahl Arbeiter produciré in derselben Zeit
520232,37,die Hälfte so würde dieselbe Arbeit 200w 200W AA w
520319,20,daß der Theil der bezahlten Arbeit der auf die Waare
520332,36,sich mit der Produktivität der Arbeit än 26 Corbett Zehntes
520369,40,in jedem Stück enthaltnen unbezahlten Arbeit um so weniger da
520386,51,in seiner Sphäre absorbirte unbezahlte Arbeit nur zufällig bestimmt ist
520414,56,durch die in ihnen enthaltne Arbeit bestimmt ist ZEHNTES KAPITEL
521009,20,das Ganze der realisirten unbezahlten Arbeit und diese Gesammtmasse stellt
521023,27,die bezahlte todte und lebendige Arbeit in der Gesammtmasse von
521230,20,Kapitale die ungleich viel lebendige Arbeit in Bewegung setzen ungleich
521250,32,voraus daß der Exploitationsgrad der Arbeit oder die Rate des
521277,42,Dies setzt Konkurrenz unter den Arbeitern voraus und Ausgleichung durch
521498,20,Sache so fassen Unterstelle die Arbeiter selbst seien im Besitz
521528,28,nach der technischen Natur ihrer Arbeiten wäre der Werth der
521585,20,etc Unterstelle ferner daß diese Arbeiter im Durchschnitt gleich viel
521591,38,im Durchschnitt gleich viel Zeit arbeiten die Ausgleichungen eingerechnet die
521601,55,aus verschiedner Intensität etc der Arbeit hervor 15 gehn Zwei
521606,74,Arbeit hervor 15 gehn Zwei Arbeiter hätten dann beide in
521741,20,Waare I absorbire mehr lebendige Arbeit erfordre also längere Arbeitszeit
521774,28,die das Produkt der von Arbeiter I und der von
521779,46,Arbeiter I und der von Arbeiter II in einer gegebnen
521786,65,in einer gegebnen Zeit verrichteten Arbeit Die Profitraten wären auch
522136,20,dies für Zustände wo dem Arbeiter die Produktionsmittel gehören und
522930,20,die unter den schlechtesten Bedingungen arbeitenden Wie immer die Preise
523111,20,wechselseitig ist Was aber die Arbeiter angeht da vorausgesetzt ist
523894,20,Waare ent 5 haltne Quantum Arbeit gesellschaftlich nothwendige Arbeit repräsentire
523897,28,haltne Quantum Arbeit gesellschaftlich nothwendige Arbeit repräsentire der individuelle Werth
524019,20,zu seiner Produktion nothwendige gesellschaftliche Arbeit enthält und daß der
525795,20,gegebnen Basis der Produktivität der Arbeit erheischt in jeder be
525890,20,bei der Waarenproduktion Theilung der Arbeit vorausgesetzt ist kauft die
525945,20,es durch die Theilung der Arbeit zufällt seine Arbeit in
525948,39,Theilung der Arbeit zufällt seine Arbeit in der Produktion dieser
525964,53,ein Aequivalent erhalten durch gesellschaftliche Arbeit dargestellt in den Artikeln
525987,60,zwischen dem Gesammtquantum der gesellschaftlichen Arbeit das auf einen gesellschaftlichen
526060,22,zu seiner Produktion erheischte gesellschaftliche Arbeit enthalten mag und von
526076,37,dieser gesammten Waarensorte nur nothwendige Arbeit darstellt so ist doch
526114,40,ein viel kleineres Quantum gesellschaftlicher Arbeit als wirklich in ihr
526192,20,einer bestimmten Waarensorte verwandten gesellschaftlichen Arbeit zu klein für den
526213,34,aber der Umfang der gesellschaftlichen Arbeit die zur Produktion eines
526540,20,Geldlohn höher so würden die Arbeiter mehr davon kaufen und
528317,20,in ihr enthaltnen gesellschaftlich nothwendigen Arbeit muß das Gesammtquantum gesellschaftlicher
528322,20,Arbeit muß das Gesammtquantum gesellschaftlicher Arbeit welches auf die 25
528372,20,30 auf jede Waarenart verwandten Arbeit auf dieses Maß zu
529015,20,und die die gesellschaftlich nothwendige Arbeit auf ein neues geringres
529534,20,zu produciren im Produkt der Arbeit ein bestimmtes Quantum unbezahlter
529539,30,Arbeit ein bestimmtes Quantum unbezahlter Arbeit sich anzueignen Und es
529563,43,gegen den specifischen Charakter ihrer Arbeit sich nach den Bedürfnissen
529973,20,Aufhebung aller Gesetze welche die Arbeiter hindern aus einer Produktionssphäre
529994,29,einem andern überzusiedeln Gleichgültigkeit des Arbeiters gegen den Inhalt seiner
529999,47,Arbeiters gegen den Inhalt seiner Arbeit Möglichste Reducirung der Arbeit
530003,66,seiner Arbeit Möglichste Reducirung der Arbeit in allen Produktionssphären auf
530009,86,in allen Produktionssphären auf einfache Arbeit 25 Wegfall aller professionellen
530017,104,aller professionellen Vorurtheile bei den Arbeitern Endlich und namentlich Unterwerfung
530024,122,und namentlich Unterwerfung des 177 Arbeiters unter die kapitalistische Produktionsweise
530185,20,der direkt von ihm beschäftigten Arbeiter nimmt darauf beschränkt daß
530210,31,ausnahmsweise Produktivität in der angewandten Arbeit ein Extraschnitt ein über
530239,40,Kapital und darum gar keine Arbeiter anwendete was in der
530294,28,Arbeitslohn auslegte Der Exploitationsgrad der Arbeit hängt aber bei gegebnem
530305,43,von der durchschnittlichen Intensität der Arbeit und bei gegebner Intensität
530320,57,ab Von dem Exploitationsgrad der Arbeit hängt die Höhe der
530362,52,der von ihm speciell beschäftigten Arbeiter hat der einzelne Kapitalist
530381,60,der persönlich von ihm ausgebeuteten Arbeiter Andrerseits hat jede besondre
530403,65,der vom Gesammtkapital angewandten gesellschaftlichen Arbeit Denn davon hängt zweierlei
530473,30,bestimmt Die besondre Produktivität der Arbeit in einer besondren Sphäre
530645,20,das in ihnen enthaltne Quantum Arbeit sträuben immer von den
530936,20,steige um 25 Dieselbe Masse Arbeit die es 20 kostete
530970,24,variablen Kapital in Bewegung gesetzte Arbeit producirt nach wie vor
531212,20,dasselbe Quantum in Bewegung gesetzter Arbeit eine Erhöhung des variablen
531792,20,pro 100 des Kapitals in Arbeit ausgelegt wird eine Lohnerhöhung
531954,20,120 Das von producirte Quantum Arbeit cvp bleibt unverändert nur
531969,34,anders vertheilt zwischen Kapitalist und Arbeiter Der Mehrwerth ist gestiegen
532266,20,über dem normalen Preis der Arbeit stand oder unter ihn
532303,22,gewöhnlich in den Konsum des Arbeiters eingehn wird 25 zum
532675,20,Veränderung in der Produktivität der Arbeit die Lebensmittel producirt also
532692,31,in den Kon30 sum des Arbeiters eingehn Oder das Verhältniß
532793,20,des variablen Kapitals Setzt dieselbe Arbeit mehr konstantes Kapital in
532802,36,in Bewegung so ist die Arbeit produktiver geworden Wenn umgekehrt
532818,50,der Pro 5 duktivität der Arbeit stattgefunden und ein Wechsel
532895,20,hat weil mehr oder weniger Arbeit erheischt ist um sie
532909,36,es daß die Produktivität der Arbeit wechselt die die 15
532946,40,hergestellt wird oder weil die Arbeit des Spinnens in Folge
533318,20,ihrem Werth verschieden ist der Arbeiter also zum Rückkauf dieser
533330,32,Ersatz mehr oder minder Arbeitszeit arbeiten also mehr oder minder
533337,50,mehr oder minder viel nothwendige Arbeit verrichten muß als nöthig
534021,20,einer gegebnen Exploitationssphäre angeeigneten lebendigen Arbeit 2 Steigen und Fallen
534329,20,dem gesellschaftlichen Gesammtkapital den 5 Arbeitern ausgepreßten Gesammtmehrwerth oder daß
534699,20,Waaren und gegebner Exploitation der Arbeit die Ersparung in den
534745,20,bestimmte Anzahl in Bewegung gesetzter Arbeiter vor 10 es ist
534762,35,sei der Arbeitslohn für 100 Arbeiter sage für 1 Woche
534769,53,für 1 Woche Verrichten diese Arbeiter ebensoviel nothwendige Arbeit wie
534772,73,Verrichten diese Arbeiter ebensoviel nothwendige Arbeit wie Mehrarbeit arbeiten sie
534775,92,ebensoviel nothwendige Arbeit wie Mehrarbeit arbeiten sie also täglich ebensoviel
534902,20,Mehrwerths bei unverändertem Exploitationsgrad der Arbeit würde sich so in
535027,20,Mehrwerths oder gleichbleibendem Exploitationsgrad der Arbeit durch das Kapital Nun
535179,20,Entwicklung der gesellschaftlichen Produktivkraft der Arbeit die sich grade darin
535203,32,und Hülfsstoffe von derselben Anzahl Arbeiter in derselben Zeit d
535211,48,Zeit d h mit weniger Arbeit in Produkte verwandelt werden
535261,40,enthält eine geringre Summe von Arbeit als 35 auf niedrigem
535272,54,der Produktion wo das in Arbeit ausgelegte Kapital in ungleich
535345,20,selbst bei steigendem Exploitationsgrad der Arbeit sich in einer beständig
535400,20,Entwicklung der gesellschaftlichen Produktivkraft der Arbeit Es ist damit nicht
535456,20,Masse der angewandten Ie bendigen Arbeit stets abnimmt im Verhältniß
535471,36,ihr in Bewegung gesetzten vergegenständlichten Arbeit der produktiv konsumirten Produktionsmittel
535483,51,auch der Theil dieser lebendigen Arbeit der unbezahlt ist und
535955,20,dem minder entwicki Land die Arbeit unproduktiver wäre daher ein
535979,26,Gebrauchswerth sich darstellte also der Arbeiter einen g ren Theil
536021,28,im minder fortgeschrit Land der Arbeiter 2A des Arbeitstags für
536136,20,Produktion und solcher wo die Arbeit noch nicht förmlich unter
536147,36,Kapital subsumirt ist obgleich der Arbeiter in Wirklichkeit vom Kapitalisten
536448,20,geringrer Theil desselben in lebendiger Arbeit dar Da also die
536459,33,der den Produktionsmitteln zugesetzten lebendigen Arbeit fällt im Verhältniß zum
536472,48,so fällt auch die unbezahlte Arbeit und der Werththeil worin
536510,49,Gesammtkapitals setzt sich in lebendige Arbeit um und dies Gesammtkapital
536534,55,des unbezahlten Theils der angewandten Arbeit zum bezahlten Theil derselben
536571,53,für die vermehrte Produktivität der Arbeit Ein Kapital von 100
536582,66,aus 80 20 letztre 20 Arbeitern Die cv Rate des
536593,81,sei 100 d h die Arbeiter arbeiten den halben 10
536594,101,100 d h die Arbeiter arbeiten den halben 10 Tag
536627,91,cv 2h beitern Aber diese Arbeiter brauchen des Arbeitstags für
536634,107,des Arbeitstags für sich und arbeiten nur Vi für den
536645,122,Alles andre gleichgesetzt produciren die Arbeiter im ersten Fall einen
536726,51,ersten Fall die Mehr 20 arbeit von nur 20 und
536735,65,und im zweiten von 80 Arbeitern an Das Gesetz des
536758,71,mit der von der lebendigen Arbeit in Bewegung gesetzten Masse
536764,88,in Bewegung gesetzten Masse vergegenständlichter Arbeit schließt in keiner Weise
536785,92,in Bewegung gesetzten und exploitirten Arbeit daher auch die absolute
536812,87,Kapitale eine wachsende Masse von Arbeit und daher von Mehrarbeit
536828,93,der 30 von ihnen kommandirten Arbeiter nicht wächst Nimmt man
536896,51,und cirkulirenden Kapitals das diese Arbeit in Bewegung setzt das
536941,44,wie vor dieselbe Masse lebendiger Arbeit kommandirt und dieselbe Masse
536961,53,weil die Masse der lebendigen Arbeit fällt sondern weil die
536975,65,in Bewegung gesetzten bereits vergegenständlichten Arbeit steigt Die Abnahme ist
536996,72,Größe der in Bewegung gesetzten Arbeit und Mehrarbeit nichts zu
537056,46,einer wachsenden Masse der kommandirten Arbeit überhaupt und ihres unbezahlten
537273,20,Anzahl der vom Kapital angewandten Arbeiter also die absolute Masse
537284,34,von ihm in Bewegung gesetzten Arbeit daher die absolute Masse
537383,20,der Steigerung der Produktivität der Arbeit steigt und wächst selbst
537402,34,Entwicklung der gesellschaftlichen Produktivkraft der Arbeit wächst noch mehr die
537420,47,Theil bilden Und die zusätzliche Arbeit durch deren Aneignung dieser
537447,53,Produktionsmittel Lebensmittel eingeschlossen da der Arbeiter im Arbeitsproceß nicht mit
537518,20,Bevölkerung und daher Ueberbevölkerung von Arbeitern Ein momentaner Ueberschuß des
537548,30,Milderung der den Nachwuchs der Arbeiter decimirenden vernichtenden Einflüsse und
537706,20,den des variablen gegen lebendige Arbeit umgesetzten Kapital theils Dieselben
537748,21,Entwicklung der Produktivkraft der gesellschaftlichen Arbeit und Vervielfältigung der Produktionszweige
537925,20,der Masse der angewandten lebendigen Arbeit Es bedarf ferner hier
537963,24,der Entwicklung der Produktivkraft der Arbeit die Masse des Mehrwerths
537992,34,Entwicklung der Produktivkraft der gesellschaftlichen Arbeit dieselben Gesetze welche im
538225,20,und selbst steigendem Exploitationsgrad der Arbeit fällt die relative 20
538330,20,Gesammtkapital von 100 weniger lebendige Arbeit überhaupt es bei gleichbleibendem
538718,20,bei gleichbleibendem cv Exploitationsgrad der Arbeit auf je 100 20
538913,20,lung der gesellschaftlichen Produktivkraft der Arbeit eine wachsend größre Masse
538960,20,weil die Produktivkraft der gesellschaftlichen Arbeit abnimmt sondern weil sie
538973,36,aus einem absoluten Mißverhältniß zwischen Arbeit und Existenzmitteln oder Mitteln
538994,48,aus der kapitalistischen Exploitation der Arbeit dem Mißverhältniß zwischen dem
539289,20,steigen muß um dieselbe Masse Arbeit unter den alten Exploitationsver
539313,29,Entwicklung der gesellschaftlichen Produktivkraft der Arbeit drückt sich im Fortschritt
539446,20,beschäftigen Die steigende Produktivkraft der Arbeit erzeugt also auf kapitalistischer
539776,20,wenn jedes zusätzliche Kapital zusätzliche Arbeit in Bewegung setzt und
540462,20,durch ein stets geringres Quantum Arbeit in Bewegung setzt absorbirt
540487,22,der producirten Gesammtmasse weniger lebendige Arbeit und enthält ferner weniger
540494,40,enthält ferner weniger ver gegenständlichte Arbeit sowohl im Verschleiß des
540527,46,während der Produktion neu zugesetzter Arbeit Der Preis der einzelnen
540561,48,Sie enthält weniger neu zugesetzte Arbeit aber der unbezahlte Theil
540611,38,einzelnen Waare neu zugesetzten lebendigen Arbeit wird auch die Masse
540621,53,der in ihr enthaltnen unbezahlten Arbeit absolut abnehmen wie sehr
540655,55,5 wicklung der Produktivkraft der Arbeit trotz des Wachsthums der
540729,20,daß sich ein gegebnes Quantum Arbeit in einer größren Masse
540741,36,jede einzelne Waare also weniger Arbeit als früher enthält Dies
540772,44,B wenn die Produktivkraft der Arbeit gleichmäßig alle Elemente des
540807,47,geringren Gesammtsumme der neu zugesetzten Arbeit kleiner ist als ein
540843,47,derselben worin überhaupt neu zugesetzte Arbeit sich darstellt fällt gegen
540885,43,worin sich neu zugesetzte lebendige Arbeit und die Zunahme der
540895,57,Preistheile worin sich früher vergegenständlichte Arbeit darstellt ist die Form
541251,20,In Folge vermehrter Produktivkraft der Arbeit sei es befähigt jährlich
541334,20,bei stets wachsender Produktionskraft der Arbeit auf 15000 und produciré
541656,20,einzelnen Waare Es ist weniger Arbeit in ihr enthalten weniger
541665,33,weniger bezahlte und unbezahlte Dieselbe Arbeit produciré das dreifache Produkt
541674,50,Produkt es kommt dann weniger Arbeit auf das einzelne Produkt
541739,26,das 35 Kapital dieselbe Masse Arbeiter wie früher bei gleichem
541752,42,kann auch geschehn wenn weniger Arbeiter bei erhöhtem Exploitationsgrad angewandt
541810,26,des durch die neu zugesetzte Arbeit geschaffnen Werthquantums zwischen Arbeiter
541814,45,zugesetzte Arbeit geschaffnen Werthquantums zwischen Arbeiter und Kapitalisten Die Profitmasse
541826,61,steigen bei Anwendung derselben Masse Arbeit wenn die unbezahlte Mehrarbeit
541838,75,bei gleichbleibendem Exploitations grad der Arbeit wenn die Anzahl der
541843,94,Arbeit wenn die Anzahl der Arbeiter sich vermehrt Oder wenn
541894,71,berechnet ein gegebnes Quantum zusätzlicher Arbeit stellt sich dar in
541969,24,wie sich die Produktivität der Arbeit vermehrte und andrerseits das
542157,20,daß bei wachsender Produktivität der Arbeit der Preis der einzelnen
542315,20,die mit der Produktivkraft der Arbeit wachsende 10 Waarenmasse und
542343,30,Verhältniß von bezahlter und unbezahlter Arbeit in der einzelnen Waare
542655,20,Entwicklung der Produktivkräfte der gesellschaftlichen Arbeit selbst nur in den
542775,20,I Erhöhung des Exploitationsgrads der Arbeit Der Exploitationsgrad der Arbeit
542779,37,der Arbeit Der Exploitationsgrad der Arbeit die Aneignung von Mehrarbeit
542797,51,des Arbeitstags und Intensifikation der Arbeit Diese beiden Punkte sind
542823,57,viele Momente der Intensifikation der Arbeit die ein Wachsthum des
542842,64,Profitrate einschließen wie wenn ein Arbeiter größre Masse von Maschinerie
542931,20,ihres Werths zum Preis der Arbeit die sie in Be
543035,20,einerseits von einer gegebnen Masse Arbeit möglichst viel in Mehrwerth
543052,35,zum vorgeschoßnen Kapital möglichst wenig Arbeit überhaupt anzuwenden sodaß dieselben
543063,50,welche erlauben den Exploitationsgrad der Arbeit zu erhöhen es verbieten
543072,67,verbieten mit demselben Gesammtkapital ebensoviel Arbeit wie früher zu exploitiren
543223,20,statt wenn die Produktivkraft der Arbeit einerlei ob ihr Produkt
543232,36,Produkt in die Konsumtion der Arbeiter eingeht oder in die
543554,20,zweite weil der Exploitationsgrad dieser Arbeit gewachsen Aber mit Bezug
543735,20,Bewegung dieser Verminderung Wenn einem Arbeiter die Arbeit aufgezwungen wird
543737,38,Verminderung Wenn einem Arbeiter die Arbeit aufgezwungen wird die rationell
544174,20,Folge der gesteigerten Produktivkraft der Arbeit den Werth seiner Elemente
544335,20,die Entwicklung der Produktivkraft der Arbeit die sich in der
544381,20,oder minder unvollständige Unterordnung der Arbeit unter das Kapital fortdauert
544469,20,Ueberwiegen des Elements der lebendigen Arbeit beruhn und erst nach
544792,20,als die Konkurrenzländer Sofern die Arbeit des fortgeschrittnern Landes hier
544798,34,des fortgeschrittnern Landes hier als Arbeit von höherm specifischen Gewicht
544810,50,steigt die Profitrate indem die Arbeit 35 die nicht als
544853,46,Profitrate entgegenwirkende Ursachen V lichte Arbeit in natura gibt als
544911,29,Produktivkraft der von ihm angewandten Arbeit als Mehrarbeit verwerthet Er
544959,25,Kulis etc die Exploitation der Arbeit Warum nun die höhern
545086,20,Das begünstigte Land erhält mehr Arbeit zurück im Austausch für
545092,37,zurück im Austausch für weniger Arbeit obgleich diese Differenz dies
545102,54,Mehr wie beim Austausch zwischen Arbeit und Kapital überhaupt von
545487,20,besteht die enthaltne zusätzliche lebendige Arbeit in einem abnehmenden Verhältniß
545516,26,stets abnehmendes Quantum zusätzlicher lebendiger Arbeit in ihnen vergegenständlicht ist
545523,44,ihnen vergegenständlicht ist weil weniger Arbeit zu ihrer Produktion erheischt
545549,52,in der Waare enthaltne lebendige Arbeit in bezahlte und 30
545566,62,in ihr enthaltnen zusätzlichen lebendigen Arbeit fällt wächst der unbezahlte
545594,64,die Gesammtmasse der zusätzlichen lebendigen Arbeit in einer 35 Waare
545629,61,Mehrwerths also im Exploitationsgrad der Arbeit Nichts alberner daher als
545699,25,Profitrate fällt nicht weil die Arbeit unproduktiver sondern weil sie
545728,35,worin sich wachsende Produktivität der Arbeit kapitalistisch ausdrückt VI Die
546920,20,Mehrwerths also der Exploitationsgrad der Arbeit und keine andre Schranke
546929,20,Schranke als den Exploitationsgrad der Arbeit wenn die Arbeiterbevölkerung gegeben
546959,31,der producirten Waaren worin unbezahlte Arbeit vergegenständlicht ist Man muß
547108,20,so und so viel unbezahlte Arbeit eingesaugt Mit der Entwicklung
547189,20,Produktionspreisen stehn so ist der Arbeiter zwar exploitirt aber seine
547618,20,Masse des Kapitals die der Arbeiter in Bewegung setzt 227
547629,31,deren Werth er durch seine Arbeit erhält und im Produkt
547655,42,Kapitals 1000 und die zugesetzte Arbeit 100 so das reproducirte
547752,20,Arbeitstag sehr lang obgleich die Arbeit unproduktiv ist sie ist
547762,36,möglich weil die Bedürfnisse der Arbeiter sehr gering darum der
547772,53,Durchschnittslohn sehr niedrig obgleich die Arbeit unproduktiv Der Niedrigkeit des
547783,69,wird 20 die Energielosigkeit der Arbeiter entsprechen Das Kapital akkumulirt
547810,70,ist groß obgleich der dem Arbeiter bezahlte Lohn klein ist
547821,83,Profitrate fällt nicht weil der Arbeiter weniger exploitirt wird 25
547835,94,zum angewandten Kapital überhaupt weniger Arbeit angewandt wird Fällt wie
547857,96,Theil des jährlichen Produkts der Arbeit vom Kapitalisten unter der
548021,20,da bei ihnen die eigne Arbeit noch eine Rolle spielt
548027,36,noch eine Rolle spielt die Arbeit des Kapitalisten 5 steht
548145,20,Entwicklung der gesellschaftlichen Produktivkraft der Arbeit zeigt sich doppelt Erstens
548200,20,der verhältnißmäßigen Kleinheit der lebendigen Arbeit die zur Reproduktion und
548361,20,zu dieser Rate gleichzeitig angewandten Arbeit oder was dasselbe durch
548398,25,andre Faktor die Anzahl der Arbeiter Soweit die Entwicklung der
548409,41,den bezahlten Theil der angewandten Arbeit vermindert steigert sie den
548429,52,von einem gegebnen Kapital angewandten Arbeit vermindert vermindert sie den
548450,60,um seine Masse herauszubringen Zwei Arbeiter die 12 Stunden täglich
548455,78,Arbeiter die 12 Stunden täglich arbeiten können nicht dieselbe Masse
548469,91,die jeder nur 2 Stunden arbeiten selbst wenn sie von
