x,y,quote
230510,88,wächst mit der Produktivität seiner Arbeit Diese Produktionsmittel spielen dabei
230532,88,Bedingung der wachsenden Produktivität der Arbeit Z B mit der
230540,104,mit der manufakturmäßigen Theilung der Arbeit und der Anwendung 30
230574,92,Folge der wachsenden Produktivität der Arbeit Andrerseits ist die Masse
230595,91,der wachsenden 35 Produktivität der Arbeit Ebenso die Masse der
230631,78,drückt die wachsende Produktivität der Arbeit aus Die Zunahme der
230743,20,der Entwicklung des Produktivgrads der Arbeit je 80 in Produktionsmitteln
230826,20,relative Größe des andern die Arbeit bezahlenden oder den variablen
230938,20,mit der wachsenden Produktivität der Arbeit nicht nur der Umfang
231112,20,genügt hätte die Nachfrage nach Arbeit um 20 zu steigern
231137,31,Entwicklung der gesellschaftlichen Produktivkraft der Arbeit Kooperation auf großer Stufenleiter
231152,45,Voraussetzung Theilung und Kombination der Arbeit organisirt Produktionsmittel durch massenhafte
231164,60,schon stofflich nur gemeinsam anwendbare Arbeits 15 mittel z B
231443,20,zur Steigerung der Produktivkraft der Arbeit und beschleunigter Produktion von
231809,20,und des Kommando s über Arbeit so andrerseits als Repulsion
231856,20,von Produktionsmitteln und Kommando über Arbeit Es ist Koncentration bereits
231992,20,paribus von der Produktivität der Arbeit diese aber von der
232272,20,betriebenen Arbeitszweigen die Produktivkraft der Arbeit treibhausmäßig gereift In allen
232325,20,Grad worin sie Beschäftigungsmittel der Arbeiter sind Ein Dampfpflug ist
232470,20,seiner Größe weniger und weniger Arbeiter Andrerseits repellirt das periodisch
232488,34,mehr früher von ihm beschäftigte Arbeiter 3 Progressive Produktion einer
232551,20,entsprechende Entwicklung der Produktivkraft der Arbeit der dadurch verursachte Wech
232686,20,wird Da die Nachfrage nach Arbeit nicht durch den Umfang
233120,20,Form von Repulsion bereits beschäftigter Arbeiter annimmt oder die mehr
233165,20,Masse der in Bewegung gesetzten Arbeiter mit der Entwicklung der
233174,37,der Pro 25 duktivkraft ihrer Arbeit mit dem breiteren und
233194,50,Stufenleiter worin größere Attraktion der Arbeiter durch das Kapital mit
233271,20,in der Zahl der beschäftigten Arbeiter bedingt Hutmacher 1851 15
233343,20,Abnahme in Folge der Maschinenkonkurrenz Arbeiter in Zinn und Kupferbergwerken
233373,30,246 613 Die Zunahme von Arbeitern ist im Allgemeinen am
233603,20,begleitenden Entwicklung der Produktivkraft der Arbeit wächst die plötzliche Expansionskraft
234256,20,der Bevölkerung unabhängige Vermehrung von Arbeitern Sie wird geschaffen durch
234268,26,Proceß der einen Theil der Arbeiter beständig freisetzt durch Methoden
234278,43,welche die Anzahl der beschäftigten Arbeiter im Verhältniß zur vermehrten
234505,20,einer Generation zum Ersatz erwachsner Arbeiter Nun hängen die Profite
234669,20,gemäß kann ein Zuwachs von Arbeitern nicht zu Markt geliefert
234780,20,Produktion einer relativen Uebervölkerung von Arbeitern für eine Nothwendigkeit der
234914,20,Zahl der von ihm kommandirten Arbeiter wächst jedoch das variable
234923,36,variable Kapital wenn der individuelle Arbeiter mehr Arbeit liefert und
234925,56,wenn der individuelle Arbeiter mehr Arbeit liefert und daher sein
234956,60,wird dann Index von mehr Arbeit aber nicht von mehr
234962,76,aber nicht von mehr beschäftigten Arbeitern Jeder Kapitalist hat das
235002,68,Masse der in Fluß gesetzten Arbeit im ersten Fall viel
235038,62,kapitalistischen Produktionsweise und Produktivkraft der Arbeit zugleich Ursache und Wirkung
235055,70,Auslage von variablem Kapital mehr Arbeit durch größere extensive oder
235218,20,Akkumulation indem er progressiv geschicktere Arbeiter durch ungeschicktere reife durch
235246,30,größeres variables 5 Kapital mehr Arbeit flüssig ohne mehr Arbeiter
235250,48,mehr Arbeit flüssig ohne mehr Arbeiter zu werben 653 andrerseits
235262,64,Kapital von derselben Größe mehr Arbeit mit derselben Masse Arbeitskraft
235286,69,oder die Freisetzung von 10 Arbeitern geht daher noch rascher
235333,55,Grad Be 15 schäftigungsmittel der Arbeiter werden wird dies Verhältniß
235349,64,Maß wie die Produktivkraft der Arbeit wächst das Kapital seine
235356,82,das Kapital seine Zufuhr von Arbeit rascher steigert als seine
235363,100,steigert als seine Nachfrage nach Arbeitern Die Ueberarbeit des beschäftigten
235458,20,Fabrikgesetzes natürlich nur erwachsne männliche Arbeiter traf The adult operatives
235523,20,ob diese Praxis Ueberzeit zu arbeiten irgend wie erträgliche Verhältnisse
235572,20,zu 35 beschäftigen würde die Arbeit billig vertheilt Wir verlangen
235590,35,allgemein nur kurze Zeit zu arbeiten wenigstens so lange der
235639,30,auf die beschäf 40 tigten Arbeiter begreift der Verfasser des
235669,38,der Mangel einer hinreichenden Anzahl arbeitender Hände So oft durch
235686,50,Arbeitsmasse ungenügend wird fühlen die Arbeiter ihre eigne Wichtigkeit und
235717,54,in solchen Fällen Gruppen von Arbeitern sich kombinirt haben um
235772,38,Mittel zur Er sparung von Arbeit sind kolossal Dennoch würde
235781,53,würde morgen allgemein die 5 Arbeit auf ein rationelles Maß
235825,48,große Mehrheit der jetzt unproduktiven Arbeiter müßte 10 in produktive
235951,20,die Nachfrage und Zufuhr von Arbeit nicht durch die Expansion
236096,20,die entsprechende erhöhte Exploitation des Arbeiters beschleunigt wieder die Akkumulation
236390,20,und im Umsehn waren die Arbeiter wieder überzählig in einem
236423,25,Damit fiel die Nachfrage nach Arbeit nicht nur relativ sondern
236545,20,40 nur die Einwanderung von Arbeitern in den fraglichen Geschäftszweig
236586,23,Lohns eine absolute Zunahme von Arbeitern und mit der absoluten
236593,41,mit der absoluten Zunahme der Arbeiter eine Abnahme des Lohns
236680,20,der Nachfrage und Zufuhr von Arbeit sich bewegt Sie zwängt
236749,20,Kapital bindet und eben dadurch Arbeiter freisetzt umgekehrt so deutet
236759,37,daß sie Kapital für den Arbeiter freisetzt Erst jetzt kann
236784,47,unmittelbar durch die Maschine verdrängten Arbeiter sondern ebenso ihre Ersatzmannschaft
236845,27,um den Markt von ebensoviel Arbeitern zu befreien als die
236873,37,größere so wächst die allgemeine Arbeits 30 nachfrage nur um
236911,40,der Maschine aufs Pflaster geworfenen Arbeiter reichen D h also
236958,34,den möglichen Untergang der deplacirten Arbeiter während der Uebergangsperiode welche
236973,47,bannt Die 40 Nachfrage nach Arbeit ist nicht identisch mit
236992,57,der kapitalistischen Akkumulation Zufuhr der Arbeit nicht mit dem Wachsthum
237027,56,Akkumulation einerseits die Nachfrage nach Arbeit vermehrt vermehrt sie andrerseits
237035,71,sie andrerseits die Zufuhr von Arbeitern durch deren Freisetzung während
237051,82,Beschäftigten zur Flüssigmachung von mehr Arbeit zwingt also in gewissem
237063,95,Arbeitszufuhr von der Zufuhr von Arbeitern unabhängig macht Die Bewegung
237075,108,der Nachfrage und Zufuhr von Arbeit auf dieser Basis vollendet
237088,120,des Kapitals Sobald daher die Arbeiter hinter das Geheimniß kommen
237103,128,selben Maß wie sie mehr arbeiten mehr fremden Reichthum produciren
237112,144,produciren und die Produktivkraft ihrer Arbeit wächst sogar ihre Funktion
237294,20,in allen möglichen Schattirungen Jeder Arbeiter gehört ihr an während
237370,20,Bergwerke u s w werden Arbeiter bald repellirt bald in
237430,20,nur die moderne Theilung der Arbeit durchgeführt ist braucht man
237437,37,ist braucht man massenhaft männliche Arbeiter bis zur Zurücklegung des
237537,20,selbst Es braucht größere Massen Arbeiter im früheren Alter geringere
237574,26,liegen weil die Theilung der Arbeit sie an einen bestimmten
237594,39,zudem so rasch daß der Arbeiter von mittlerem Alter sich
237627,44,Staffel hinabgedrängt Gerade bei den Arbeitern der großen Industrie stoßen
237737,20,von 1866 80 90 000 Arbeiter in London außer Arbeit
237741,38,000 Arbeiter in London außer Arbeit geworfen wurden heißt es
237867,20,Folge der Verhältnisse worin die Arbeiter der großen Indu 5
238069,20,durch 25 schnittliche Normalniveau der arbeitenden Klasse und grade dies
238452,20,ihrer durch die Theilung der Arbeit verursachten Unbeweglichkeit untergehn solche
238462,32,die über das Normalalter eines Arbeiters hinausleben endlich die Opfer
238688,20,Proletariats und die Produktivkraft seiner Arbeit desto größer die industrielle
238872,20,in der Produktivität der gesellschaftlichen Arbeit mit einer progressiv abnehmenden
238897,31,kapitalistischer Grundlage wo nicht der Arbeiter die Arbeitsmittel sondern die
238904,48,Arbeitsmittel sondern die Arbeitsmittel den Arbeiter anwenden darin aus daß
238914,64,je höher die Produktivkraft der Arbeit desto größer der Druck
238920,83,desto größer der Druck der Arbeiter auf ihre Beschäftigungsmittel desto
238952,78,Produktionsmittel und der Produktivität der Arbeit als der produktiven Bevölkerung
239002,59,Steigerung der gesellschaftlichen Produktivkraft der Arbeit auf Kosten des individuellen
239007,75,Arbeit auf Kosten des individuellen Arbeiters alle Mittel zur Entwicklung
239026,83,Pro 40 ducenten verstümmeln den Arbeiter in einen Theilmenschen entwürdigen
239048,85,Abschnitt Der Akkumulationsprozeß des Kapitals Arbeit ihren Inhalt entfremden ihm
239141,20,Kapital akkumulirt die Lage des Arbeiters welches immer seine Zah
239176,27,in Gleichgewicht hält schmiedet den Arbeiter fester an das Kapital
239559,20,des Reichthums Gesetzlicher Zwang zur Arbeit ist verbunden mit zu
239586,27,natürlichstes Motiv zur Industrie und Arbeit die machtvollste Anstrengung hervorruft
239917,20,Die Menschen wurden damals zur Arbeit d h zur Gratisarbeit
239936,31,die Menschen sind jetzt zur Arbeit d h zur Gratisarbeit
239985,26,Bedürfnisse zugleich zum Sporn ihrer Arbeit für die Delikateren machen
240085,20,Wissenschaft sagt Sismondi kann jeder Arbeiter jeden Tag viel mehr
240105,34,10 eher Zeit während seine Arbeit den Reichthum producirt würde
240123,47,konsumiren ihn wenig geeignet zur Arbeit machen Nach ihm würden
240156,50,sie diese 15 durch anhaltende Arbeit wie die des Arbeiters
240160,68,anhaltende Arbeit wie die des Arbeiters erkaufen Die Anstrengungen sind
240200,63,endlose Vervielfältigung der Produktivkräfte der Arbeit kann also kein andres
241431,20,und dem Elend 25 der arbeitenden Klasse gleichzeitig eine beständige
242254,20,keine Zunahme im Komfort der arbeitenden Klassen wahrnehmbar ist Die
242259,25,arbeitenden Klassen wahrnehmbar ist Die Arbeiter werden fast Sklaven der
242307,23,beschäftigte uns damals vorzugsweise der Arbeiter während seiner gesellschaftlichen Funktion
242529,20,und daher das Selbstgefühl der Arbeiter sich entwickeln Z B
242572,20,Was die wachsende Abhängigkeit der Arbeiter von dem Krämer betrifft
242657,20,unbedingt den zunehmenden Abscheu der Arbeiter vor der Sklaverei des
242865,20,Privy Council erkor zu dieser Arbeit den obenerwähnten Dr Smith
242948,20,seines Kapitels über Theilung der Arbeit those employed in every
242989,23,der untersuchten Klassen der städtischen Arbeiter die Zufuhr von Stickstoff
243221,20,vorgeschlagen für 30 die Lancashire Arbeiter auf gleiche Zahl männlicher
243797,20,Es ist die Armuth von Arbeitern Ja mit Bezug auf
243804,29,mit Bezug auf die städtischen Arbeiter ist die Arbeit wodurch
243807,48,die städtischen Arbeiter ist die Arbeit wodurch der knappe Bissen
243832,57,bedingtem Sinn sagen daß diese Arbeit selbsterhaltend ist Auf sehr
243903,22,größer die entsprechende Anhäufung von Arbeitern auf demselben Raum daß
243919,38,desto elender der Wohnungszustand der Arbeiter Die 20 den Fortschritt
244127,20,als in den Wohnungsverhältnissen der arbeitenden Klasse Jede große Stadt
244219,20,den Städten statt Die meisterhaften Arbeiten des Dr Julian Hunter
244643,20,so übermäßig geworden daß wenige Arbeiter mehr als ein Zimmer
244842,20,Beginn ihrer Ausführung Werden die Arbeiter verjagt durch Zerstörung ihrer
244908,20,sie verjagt Die Hälfte der Arbeiter im Strand braucht bereits
244985,20,durch Niederschleifen untauglicher Häuser die Arbeiter aus einem Viertel verjagt
245148,20,erklecklichen Profit getröstet werden Der Arbeiter 10 wird mit Frau
245338,20,elender die improvisirten Wohnlichkeiten der Arbeiter Newcastle upon Tyne als
245473,20,allgemeine Gesetz der kapitalistischen Akkumulation Arbeiter häufig leben liegen in
245606,20,und Herwogens von Kapital und Arbeit mag der Wohnungszustand einer
245762,20,126 Liste des Agenten einer Arbeiter Assekuranzgesellschaft zu Bradford Vulcanstreet
245892,20,erhielt waren meist von gutbezahlten Arbeitern bewohnt Sie erklärten sie
246334,20,10 Herrn Kontraktor der die Arbeiter doppelt ausbeutet als Industriesoldaten
246414,20,Kurz vor dieser Zeit wurden Arbeiten für eine Eisenbahn von
246477,20,Hütten aufschlagen zur Behausung der Arbeiter Diese Hütten besaßen weder
246786,20,als möglich halten m Die Arbeiter in Kohlen und anderen
246984,20,Wohnungen der Gruben und andrer Arbeiter die 30 mit den
247062,20,und andren am Eisenbahnbau beschäftigten Arbeitern zur Wohnung Die Höhlen
247122,20,Note bezieht sich namentlich auf Arbeiter in Kohlenbergwerken Ueber den
247351,20,dichtbevölkerten Distrikten herrschende 20 Der Arbeiter ist gezwungen als Theil
247419,20,Resultat ist ziemlich unfehlbar Der Arbeiter erhält von dem Eigenthümer
247481,20,es Funktion und Häuslichkeit des Arbeiters bannt damit zu rechtfertigen
247714,20,den Grundherrn den Minenpächter die Arbeiter oder das Publikum Aber
247766,20,Grundherr eine industrielle Kolonie zur Arbeit auf seiner Domaine ein
247785,35,Grundoberfläche den von ihm versammelten Arbeitern unmöglich die zu ihrem
247831,32,ihn fallen und daß die Arbeiter auf die sie fallen
248061,20,Zur Charakteristik der Lage der Arbeiter folgende 10 Stelle aus
248102,21,befinden sich mindestens 15 000 Arbeiter sammt Familien in einem
248200,20,die Männer bei besserem Wetter arbeiten Am Tage meines Besuchs
248403,20,In diesem Augenblick während englische Arbeiter mit Weib und Kind
248421,33,englischem Geld dem Produkt englischer Arbeit in russischen spanischen italienischen
248469,29,Minimum von Nahrung am längsten arbeiten könne denn Ausdauer war
248500,37,die höchsten 5 Löhne geschickter Arbeit in diesem Land verdienten
249208,20,daß es unmöglich für sie Arbeit zu finden und nutzlos
249248,20,Belgien als das Paradies des Arbeiters zu schildern weil die
249255,38,schildern weil die Freiheit der Arbeit oder was dasselbe ist
249286,46,über das Glück des belgischen Arbeiters Sicher war niemand tiefer
249461,20,Aus der Gesammtzusammenstellung der den Arbeitern der verschiednen Geschäftszweige bewilligten
249559,20,tritt jeden Tag vor die Arbeiter Der Budget der Familie
249606,20,Deficit würden ausmachen falls der Arbeiter die Nahrung hätte Des
249668,20,gegen die täglichen Unterhaltungskosten des Arbeiters einen Unterschied von 13
249713,20,kapitalistischen Akkumulation große Mehrzahl der Arbeiter in noch sparsameren Verhältnissen
249727,37,zu Nothbehelfen flüchtet wovon der Arbeiter allein das Geheimniß hat
249818,20,eine Krankheit das Elend des Arbeiters und ruinirt ihn vollständig
250112,20,Kapitals nen Zeitalter der englischen Arbeiter in Stadt und Land
250183,20,in Hand zur Unterdrückung des Arbeiters 139 Es wird dann
250408,20,der für bloße Vegetation des Arbeiters erheischten Nominalsumme Das Verhältniß
250834,20,blieb von nun an der Arbeiter das instrumentum vocale das
251085,20,Frage welche von beiden den Arbeiter am schamlosesten ausbeute wurde
251216,20,Bankes von den Hundelöhnen der Arbeiter wieder einen bedeutenden Theil
252225,20,Hausvermiether die Miethe für einen Arbeiter er Dreiundzwanzigstes Kapitel Das
252507,20,heißt es könnte sagen Ich arbeite hart und habe nicht
252583,20,der Pächter den Lohn des Arbeiters heruntersetzt weil dessen Frau
252781,20,3 94 143 98 Kutschenmacher Arbeiter 24 53 162 06
252813,27,einen viel größeren für seine Arbeit unentbehrlichen Theil der Lebensmittel
252892,20,962 im Jahr 1861 Die Arbeit der Weiber auf freiem
253398,20,wie sie gezwungen waren leichte Arbeit ein Loch durch die
253685,20,Außer soweit diejenigen die seine Arbeit bereichert es der Mühe
253804,20,ebensowenig behält das Gesetz dem Arbeiter auch nur das kleinste
253817,35,Boden vor für welchen seine Arbeit so nothwendig ist wie
253884,20,und permanente Unabhängigkeit dem hartschanzenden Arbeiter und seiner Familie zu
254188,20,in dem Kirchspiel worin sie arbeiten zu werden 1861 verglichen
254274,20,finden daß die darauf beschäftigten Arbeiter keine Haussassen des Grundeigenthümers
254344,20,das Obdach zusammenhält wird dem Arbeiter erlaubt Rente dafür zu
254488,20,500 Acres die nur die Arbeit eines Mannes erheischt Zur
254544,20,Der Akkumulationsprozeß des Kapitals ausgeworfnen Arbeiter auf die nächste sage
254563,35,vom Pachthof sein wo der Arbeiter sich täglich abzuplacken hat
254689,20,Boden den er bebaut behauste Arbeiter eine Wohnlichkeit findet wie
254724,27,Stall gut genug für ihre Arbeiter und deren Familien glauben
254751,37,nur 165 Die Häuser der Arbeiter in den offnen Ortschaften
254992,20,der Güter schlafen worauf sie arbeiten I e p 135
255027,25,direkt oder indirekt durch die Arbeit eines Mannes dem er
255120,20,Macht 45 bereit mit einem Arbeite für mich zu diesem
255178,20,dem Graben ohne Garten der Arbeiter ist hülflos gegen die
256478,20,existirenden Häuser zerstört Ein armer Arbeiter der ungefähr 4 Meilen
257211,20,d per Woche Nah seiner Arbeit Nein 6 Meilen entfernt
257413,20,dieser Ortschaft wo viel 10 Arbeit nöthig verschiedne Cots zerstört
257542,20,des Grabens das Feld nach Arbeit schreit werfen ihm die
257548,37,schreit werfen ihm die geprellten Arbeiter 25 von der andren
258737,20,400 bis 1000 Acres ansässige Arbeiter sie heißen hier confined
258797,20,Sie hat keine Cottage Ein Arbeiter wohnt jetzt bei mir
258967,20,in kürzester Zeit möglichst viel Arbeit aus seiner Bande flüssig
258986,33,nur unter männlicher Diktatur ordentlich arbeiten daß aber Frauenzimmer und
259012,43,während 719 der erwachsne männliche Arbeiter so heimtükkisch ist damit
259399,20,zählen aber weniger Köpfe und arbeiten statt unter dem Gangmeister
259523,20,möglichst wenig Geld möglichst viel Arbeit herauszuschlagen178 und den erwachsnen
259529,37,herauszuschlagen178 und den erwachsnen männlichen Arbeiter überzählig zu machen Nach
259558,46,wegen Mangels 10 an männlicher Arbeit und ihrer Wanderung nach
259716,20,Gangarbeit ist wohlfeiler als andre Arbeit das ist die Ursache
260407,20,stacheln in der Brust der arbeitenden Armen Gefühle auf die
262001,20,ohne sich durch Einverleibung fremder Arbeit zu verwerthen sind eben
262472,20,zurückbleibenden von der Uebervölkerung befreiten Arbeiter Irlands Daß die relative
263485,20,Arbeitsfeld gelegenen Hütten wegzufegen Viele Arbeiter wurden so gezwungen in
263559,20,Lasters Die Männer müssen jetzt Arbeit suchen bei benachbarten Pächtern
263634,20,aufzunehmen was als Ueberschuß von Arbeitern in den Landdistrikten galt
263661,32,auf dem Lande Mangel an Arbeitern herrscht 18 Die Wahrheit
264166,20,Bemühung eines 20 geschickten irischen Arbeiters aus den allerdürftigsten Mitteln
264214,20,Ich bin ein beetler und arbeite von 6 Uhr Morgens
264251,26,habe 5 Kinder Für diese Arbeit erhalte ich 10 sh
264322,20,essen nichts bevor wir zur Arbeit gehn Das zwölfjährige Kind
265802,20,Masse die immer noch aller Arbeit zum Trotz nichts zu
265826,20,sie längst aufgehört haben zu arbeiten Solche fade Kinderei kaut
265902,20,die Idylle Recht und 15 Arbeit waren von jeher die
266005,20,25 der Arbeitskraft andrerseits freie Arbeiter Verkäufer der eignen Arbeitskraft
266014,36,Arbeitskraft und daher Verkäufer von Arbeit Freie Arbeiter in dem
266016,56,daher Verkäufer von Arbeit Freie Arbeiter in dem Doppelsinn daß
266076,36,setzt die Scheidung zwischen den Arbeitern und dem Eigenthum an
266084,53,Eigenthum an den Verwirklichungsbedingungen der Arbeit voraus Sobald die kapitalistische
266124,51,sein als der Scheidungsproceß des Arbeiters vom Eigenthum an seinen
266216,20,freigesetzt Der unmittelbare Producent der Arbeiter konnte erst dann über
266487,20,erzeugt war die Knechtschaft des Arbeiters Der Fortgang 35 bestand
266758,20,Bauern die ihre Mußezeit durch Arbeit bei großen Grundeigenthümern verwertheten
266856,20,Bewegung in umgekehrter Richtung Die Arbeiter derStädte wurden massenweise aufs
267564,20,Bauern und die Cottages der Arbeiter wurden gewaltsam niedergerissen oder
268507,20,Acres zur Cottage würden den Arbeiter zu unabhängig machen 194
269091,20,giebt die unwillig sind zu arbeiten und ohne Vermögen oder
269109,26,erwerben so daß sie ohne Arbeit leben könnten so as
270948,20,Leute die ihre Subsistenz durch Arbeit für Andre gewinnen müssen
270970,20,E s wird vielleicht mehr Arbeit verrichtet weil mehr Zwang
271152,20,man Leute nicht länger ihre Arbeit im offnen Feld 25
271274,20,freie Leute weg von der Arbeit zum Kriegsdienst genommen worden
271428,20,Kapitals Leute die für andre arbeiten müssen mehr Arbeit flüssig
271431,37,für andre arbeiten müssen mehr Arbeit flüssig gemacht wird so
271460,47,größer sein wenn ihre kombinirte Arbeit auf einer Pachtung angewandt
274521,20,zurückzukehren und sich an die Arbeit zu setzen to put
274590,20,verordnet daß wenn Jemand zu arbeiten weigert soll er als
274637,20,jeder auch noch so eklen Arbeit durch Auspeitschung und Ankettung
274961,20,und zu trinken geben und Arbeit für sie finden wollen
275344,20,sie sich herumtreiben und nicht arbeiten sie die kein Mensch
275351,32,die kein Mensch an die Arbeit setzen will 35 sie
275768,20,Zufuhr von und Nachfrage nach Arbeit und daher den Arbeitslohn
275796,26,Herrschaft des Kapitalisten über den Arbeiter Außerökonomische unmittelbare Gewalt wird
275816,39,Gang der Dinge kann der Arbeiter den Naturgesetzen der Produktion
275880,20,Arbeitstag zu verlängern und den Arbeiter selbst in normalem 764
275956,20,Stadt standen sich Meister und Arbeiter social nahe Die Unterordnung
275962,38,social nahe Die Unterordnung der Arbeit unter das Kapital war
276033,20,in ten 10 Konsumtionsfonds des Arbeiters Die Gesetzgebung über die
276045,36,Haus aus auf Exploitation des Arbeiters gemünzt und ihm in
276186,20,Stückwerk und Tagwerk Die ländlichen Arbeiter sollen sich aufs Jahr
276267,20,Meister sogar durch körperlichen Zwang Arbeit zum gesetzlichen Lohntarif zu
276429,20,man weiß die Lage der Arbeiter sehr verschlechtert Der Geldlohn
276711,20,der Mangel an Dienstboten und Arbeitern Allen Dorfsassen wurde verboten
277025,20,aber Kriminalklage gegen den kontraktbrüchigen Arbeiter erlauben stehn bis zur
277126,20,die Mittel deren sich die Arbeiter bedienen können bei einem
277321,20,Union der Kapitalisten gegen die Arbeiter behauptet hatte Gleich im
277339,33,eben erst eroberte Associationsrecht den Arbeitern wieder zu entziehn Durch
277385,31,Konkurrenzkampf zwischen 768 Kapital und Arbeit staatspolizeilich innerhalb dem Kapital
277467,20,Sklaverei ist dürfen dennoch die Arbeiter sich nicht über ihre
277504,26,Unternehmer verletzen die Freiheit die Arbeiter in der Sklaverei zu
277566,20,die mit dem Exploitationsgrad der Arbeit die Akkumulation des Kapitals
277943,20,Ackerknecht sich selbst durch ihre Arbeit bereichern bleiben die Umstände
279284,20,große Arbeitskasernen zusammengerückt wie die Arbeiter wie das Rohmaterial Und
279317,20,zu kommandiren232 und ihnen unbezahlte Arbeit auszusaugen Den großen Manufakturen
279395,20,von Menschen unter einem Direktor arbeiten und die man gewöhnlich
279412,35,wo eine sehr große Anzahl Arbeiter zersplittert und jeder für
279464,27,Unternehmer wunderbar bereichern aber die Arbeiter sind nur besser oder
279496,35,Niemand reich aber eine Menge Arbeiter befindet sich im Wohlstand
279507,50,Zahl der fleißigen und wirthschaftlichen Arbeiter wird wachsen weil sie
279814,20,Menge kleiner für eigne Rechnung arbeitender 15 Producenten koncentrirt sich
279971,20,als Nebenzweig und die industrielle Arbeit zum Verkauf des Produkts
280746,20,Grundeigenthü mer die Rente dem Arbeiter den Lohn dem Steuer
280773,20,Theil des jährlichen Produkts der Arbeit für sich selbst Der
281411,20,Bourgeois sich selbst und den Arbeiter macht wo er die
283130,20,unterwürfig frugal fleißig und mit Arbeit überladen zu machen Der
283253,20,Kunstmittel Fabrikanten zu fabriciren unabhängige Arbeiter zu expropriiren die nationalen
283777,20,Aufseher wurden bestellt um ihre Arbeit zu überwachen Es war
283870,20,die Peitsche sie an der Arbeit hielt Ja in einigen
284474,20,zu entbinden den Scheidungsproceß zwischen Arbeitern und Arbeitsbedingungen zu vollziehn
284500,23,Volksmasse in Lohnarbeiter in freie arbeitende Arme dies 10 Kunstprodukt
284614,20,s w andrerseits zu den Arbeitern die noch 20 keine
285011,20,die Auflösung des auf eigner Arbeit beruhenden Privateigenthums Privateigenthum als
285042,24,nachdem aber diese Privatleute die Arbeiter oder die Nichtarbeiter sind
285077,32,Zwischenzustände wieder Das Privateigenthum des Arbeiters an seinen Pro15 duktionsmitteln
285103,42,und der freien Individualität des Arbeiters selbst Allerdings existirt diese
285135,47,adäquate klassische Form wo der Arbeiter freier Privateigenthümer seiner von
285185,37,auch die Kooperation Theilung der Arbeit innerhalb derselben Produktionsprocesse gesellschaftliche
285393,20,Exploitation fremder aber formell freier Arbeit beruht251 Sobald 10 dieser
285411,33,hinreichend zersetzt hat sobald die Arbeiter in Proletarier ihre Arbeitsbedingungen
285433,45,gewinnt die weitere Vergesellschaftung der Arbeit und weitere Verwandlung der
285468,47,ist nicht länger der selbstwirthschaftende Arbeiter sondern der viele Arbeiter
