x,y,quote
349,20,dem Menschen viel oder wenig Arbeit kostet Bei Betrachtung der
1222,20,oder sonst einer bestimmten produktiven Arbeit Mit dem nützlichen Charakter
1239,21,rakter der in ihnen dargestellten Arbeiten es verschwinden also auch
1249,38,die verschiednen konkreten Formen dieser Arbeiten sie unterscheiden sich nicht
1262,53,allzusammt reducirt auf gleiche menschliche Arbeit abstrakt menschliche Arbeit Betrachten
1265,73,gleiche menschliche Arbeit abstrakt menschliche Arbeit Betrachten wir nun das
1289,76,eine bloße Gallerte unterschiedsloser menschlicher Arbeit d h der Verausgabung
1317,74,Produktion menschliche Arbeitskraft verausgabt menschliche Arbeit aufgehäuft ist Als Krystalle
1419,20,einen Werth weil abstrakt menschliche Arbeit in ihm vergegenständlicht oder
1504,20,Ware hältenen werthbildenden Substanz der Arbeit Die Quantität der Arbeit
1508,38,der Arbeit Die Quantität der Arbeit selbst mißt sich an
1570,21,zu ihrer Verfertigung braucht Die Arbeit jedoch welche die Substanz
1581,38,Werthe bildet ist gleiche menschliche Arbeit Verausgabung derselben menschlichen Arbeitskraft
1618,41,Arbeitskräften besteht Jede dieser individuellen Arbeits 1 6 kräfte ist
1687,20,von Geschick und Intensität der Arbeit darzustellen Nach der Einführung
1703,36,genügte vielleicht halb so viel Arbeit als vorher um ein
1763,20,nur das Quantum gesellschaftlich nothwendiger Arbeit oder die zur Herstellung
1798,27,sind oder die in derselben Arbeits 9 Note zur 2
1859,20,nothwendig erheischten und gewöhnlich angewandten Arbeit Some Thoughts on the
2019,20,Wechsel in der Produktivkraft der Arbeit Die Produktivkraft der Arbeit
2023,37,der Arbeit Die Produktivkraft der Arbeit ist durch mannigfache Umstände
2037,52,den Durchschnittsgrad des Geschickes der Arbeiter die Entwicklungsstufe der Wissenschaft
2063,59,und durch Naturverhältnisse Dasselbe Quantum Arbeit stellt sich z B
2083,65,in nur 4 Dasselbe Quantum Arbeit liefert mehr Metalle in
2119,62,sie in wenig Volumen viel Arbeit dar Jacob bezweifelt daß
2164,52,erreicht obgleich sie viel mehr Arbeit darstellte also mehr Werth
2188,57,sinken Gelingt es mit wenig Arbeit Kohle in Diamant zu
2209,64,Je größer die Produktivkraft der Arbeit desto kleiner die zur
2236,66,je kleiner die Produktivkraft der Arbeit desto größer die zur
2270,63,der sich in ihr verwirklichenden Arbeit Ein Ding kann Gebrauchswerth
2293,66,für den Menschen nicht durch Arbeit vermittelt ist So Luft
2314,71,kann nützlich und Produkt menschlicher Arbeit sein ohne Waare zu
2382,37,auch die in ihm enthaltene Arbeit nutzlos zählt nicht als
2387,54,Arbeit nutzlos zählt nicht als Arbeit und bildet da 5
2402,68,der in den Waaren dargestellten Arbeit Ursprünglich erschien uns die
2420,76,zeigte sich daß auch die Arbeit soweit sie im Werth
2448,74,der in der Waare enthaltenen Arbeit ist zuerst von mir
2541,20,Gegenstand Mittel und Resultat Die Arbeit deren Nützlichkeit sich so
2563,33,ist nennen wir kurzweg nützliche Arbeit Unter diesem Gesichtspunkt wird
2590,43,sind die ihr Dasein vermittelnden Arbeiten qualitativ verschieden Schneiderei und
2609,53,daher Produkte qualitativ verschiedner nützlicher Arbeiten so könnten sie sich
2654,46,Familie Unterart Varietät verschiedner nützlicher Arbeiten 35 eine gesellschaftliche Theilung
2660,63,35 eine gesellschaftliche Theilung der Arbeit Sie ist Existenzbedingung 9
2695,62,Geld sehen Gemeinde ist die Arbeit gesellschaftlich getheilt ohne daß
2715,67,in jeder Fabrik ist die Arbeit systematisch getheilt aber diese
2726,80,nicht dadurch vermittelt daß die Arbeiter ihre individuellen Produkte austauschen
2761,73,zweckmäßig produktive Thätigkeit oder nützliche Arbeit Gebrauchswerthe können sich nicht
2774,82,wenn nicht qualitativ verschiedne nützliche Arbeiten in ihnen stecken In
2803,79,dieser qualitative Unterschied der nützlichen Arbeiten welche unabhängig von einander
2823,81,zu einer gesellschaftlichen Theilung der Arbeit Dem Rock ist es
2859,72,Rock und der ihn producirenden Arbeit an und für sich
2878,76,Glied der gesellschaftlichen Theilung der Arbeit Wo ihn das Kleidungsbedürfniß
2935,52,Bildnerin von Gebrauchswerthen als nützliche Arbeit ist die Arbeit daher
2938,70,als nützliche Arbeit ist die Arbeit daher eine von allen
2980,63,von zwei Elementen Naturstoff und Arbeit Zieht man die Gesammtsumme
2988,77,die Gesammtsumme aller verschiedenen nützlichen Arbeiten ab die in 10
3039,60,ändern13 Noch mehr In dieser Arbeit der For 13 Tutti
3097,38,er beständig unterstützt von Naturkräften Arbeit ist also nicht die
3113,50,Gebrauchswerthe des stofflichen Reichthums Die Arbeit ist sein Vater wie
3205,20,gleicher Substanz objektive Ausdrücke gleichartiger Arbeit Aber Schneiderei und Weberei
3213,37,und Weberei sind qualitativ verschiedne Arbeiten Es giebt jedoch Gesellschaftszustände
3233,49,Arbeitsweisen daher nur Modifikationen der Arbeit desselben Individuums und noch
3264,53,macht nur Variationen derselben individuellen Arbeit voraussetzen Der Augenschein lehrt
3286,59,Arbeitsnachfrage eine gegebene Portion menschlicher Arbeit abwechselnd in der Form
3305,66,zugeführt wird Dieser Formwechsel der Arbeit mag nicht ohne Friction
3330,68,daher vom nützlichen Charakter der Arbeit so bleibt das an
3370,60,in diesem Sinn beide menschliche Arbeit Es sind nur zwei
3408,56,der Waare aber stellt menschliche Arbeit schlechthin dar Verausgabung menschlicher
3413,73,Arbeit schlechthin dar Verausgabung menschlicher Arbeit überhaupt Wie nun in
3549,20,auch hier mit der menschlichen Arbeit Sie ist Verausgabung einfacher
3591,22,einer vorhandnen Gesellschaft gegeben Komplicirtere Arbeit gilt nur als potenzine
3600,39,potenzine oder vielmehr multiplicirte einfache Arbeit so daß ein kleineres
3607,58,daß ein kleineres Quantum komplicirter Arbeit gleich einem größeren Quantum
3613,77,gleich einem größeren Quantum einfacher Arbeit Daß diese Reduktion beständig
3631,85,Pro 10 dukt der komplicirtesten Arbeit sein ihr Werth setzt
3640,101,setzt sie dem Produkt einfacher Arbeit gleich und stellt daher
3651,116,nur ein bestimmtes Quantum einfacher Arbeit dar15 Die verschiednen Proportionen
3661,132,worin verschiedne Arbeitsarten auf einfache Arbeit als ihre Maßeinheit reducirt
3729,75,abstrahirt ist so in den Arbeiten die sich in diesen
3780,54,die in diesen Werthen enthaltenen Arbeiten nicht durch ihr produktives
3836,36,Qualität besitzen die Qualität menschlicher Arbeit Rock und Leinwand sind
3880,34,Leinwand nur halb so viel Arbeit ent 14 Vgl Hegel
3910,42,die Rede ist den der Arbeiter für etwa einen Arbeitstag
3979,20,in der Waare enthal tene Arbeit nur qualitativ gilt gilt
3997,35,nachdem sie bereits auf menschliche Arbeit ohne weitere Qualität reducirt
4013,48,das Wie und Was der Arbeit hier um ihr Wie
4033,58,Quantum der in ihr enthaltenen Arbeit darstellt müssen Waaren in
4057,62,Produktion eines Rocks erheischten nützlichen Arbeiten unverändert so steigt die
4092,59,Produktion eines Rocks noth wendige Arbeit steige auf das Doppelte
4147,41,die in ihm enthaltene nützliche Arbeit nach wie vor von
4222,20,aus dem zwieschlächtigen Charakter der Arbeit Produktivkraft ist natürlich stets
4230,37,natürlich stets Produktivkraft nützlicher konkreter Arbeit und bestimmt in der
4247,51,in gegebnem Zeitraum Die nützliche Arbeit wird daher rei chere
4274,56,Produktivkraft die im Werth dargestellte Arbeit an und für sich
4289,66,der konkreten nützlichen Form der Arbeit angehört kann sie natürlich
4295,84,angehört kann sie natürlich die Arbeit nicht mehr berühren sobald
4309,97,liehen Form abstrahirt wird Dieselbe Arbeit ergiebt daher in denselben
4349,80,Produktivkraft der die Fruchtbarkeit der Arbeit und daher die Masse
4387,68,ab kürzt Ebenso umgekehrt Alle Arbeit ist einerseits Verausgabung menschlicher
4405,74,gleicher menschlicher oder abstrakt menschlicher Arbeit bildet sie den Waaren
4412,91,sie den Waaren Werth Alle Arbeit ist 5 andrerseits Verausgabung
4430,98,in dieser Eigenschaft konkreter nützlicher Arbeit pro ducirt sie Gebrauchswerthe16
4574,20,Ausdrücke derselben gesellschaftlichen Einheit menschlicher Arbeit sind daß ihre Werthgegenständlichkeit
4590,34,Um zu beweisen daß die Arbeit allein das endgültige und
4617,44,25 Â Smith Gleiche Quantitäten Arbeit müssen zu allen Zeiten
4628,58,an allen Orten für den Arbeiter selbst denselben Werth haben
4703,20,Waarenwerthe durch den Werth der Arbeit und sucht daher nachzuweisen
4711,37,daher nachzuweisen daß gleiche Quantitäten Arbeit stets denselben Werth haben
4721,54,Andrerseits ahnt er daß die Arbeit soweit sie sich im
5808,20,die Waaren bloße Gallerten menschlicher Arbeit so reducirt unsre Analyse
5863,20,wird die in ihm steckende Arbeit der in ihr steckenden
5868,38,Arbeit der in ihr steckenden Arbeit gleichge setzt Nun ist
5890,50,die Leinwand macht verschiedenartige konkrete Arbeit Aber die Gleichsetzung mit
5905,62,thatsächlich auf das in beiden Arbeiten wirklich Gleiche auf ihren
5913,79,auf ihren gemeinsamen Charakter menschlicher Arbeit Auf diesem Umweg ist
5937,81,Schneiderei besitzt also abstrakt menschliche Arbeit ist Nur der Aequivalenzausdruck
5950,92,den specifischen Charakter der werthbildenden Arbeit zum Vorschein indem er
5962,105,den verschiedenartigen Waaren steckenden verschiedenartigen Arbeiten thatsächlich auf ihr Gemeinsames
5970,122,ihr Gemeinsames reducirt auf menschliche Arbeit überhaupt1721 17a Note zur
6001,108,nicht den specifischen Charakter der Arbeit auszudrükken woraus der Werth
6016,113,im flüssigen Zustand oder menschliche Arbeit bildet Werth aber ist
6038,111,den Leinwandwerth als Gallerte menschlicher Arbeit auszudrücken muß er als
6181,20,worden Es ist also menschliche Arbeit in ihm aufgehäuft Nach
6347,20,ist als der Austausch einer Arbeit gegen andre Arbeit wird
6350,37,Austausch einer Arbeit gegen andre Arbeit wird der Werth aller
6360,55,Dinge am richtigsten geschätzt in Arbeit The Works of Franklin
6388,60,den Werth aller Dinge in Arbeit schätzt er von der
6396,75,von der Verschiedenheit der ausgetauschten Arbeiten abstrahirt und sie so
6404,93,sie so auf gleiche menschliche Arbeit reducirt Was er nicht
6419,103,spricht erst von der einen Arbeit dann von der andren
6424,122,Arbeit dann von der andren Arbeit schließlich von Arbeit ohne
6427,142,der andren Arbeit schließlich von Arbeit ohne weitere Bezeichnung als
6542,20,Um zu sagen daß die Arbeit in der abstrakten Eigenschaft
6548,37,in der abstrakten Eigenschaft menschlicher Arbeit ihren eignen Werth bildet
6568,50,also Werth ist aus derselben Arbeit besteht wie die Leinwand
6705,20,Werthkörper bezieht als Materiatur menschlicher Arbeit macht sie den Gebrauchswerth
6770,20,enthält ein bestimmtes Quantum menschlicher Arbeit Die Werthform hat also
6953,20,beide Waarenquanta also gleich viel Arbeit kosten oder gleich große
7582,20,steigt obgleich unterdessen nicht weniger Arbeit auf A verausgabt wird
7643,20,das Quantum der ihr einverleibten Arbeit denn wenn ein Wechsel
7708,20,auf einen Artikel verausgabte Quantität Arbeit seinen Werth regulirt sondern
8752,20,stets als Verkörperung abstrakt menschlicher Arbeit und ist stets das
8762,20,Produkt einer bestimmten nützlichen konkreten Arbeit Diese konkrete Arbeit wird
8765,39,nützlichen konkreten Arbeit Diese konkrete Arbeit wird 26 also zum
8773,58,also zum Ausdruck abstrakt menschlicher Arbeit Gilt der Rock z
8796,64,als bloße Verwirklichungsform abstrakt menschlicher Arbeit Im Werthausdruck der Leinwand
8831,61,Werth ist also Gallerte von Arbeit die sich durchaus nicht
8842,73,von der im Leinwandwerth vergegenständlichten Arbeit Um solch einen Werthspiegel
8860,82,außer ihrer abstrakten Eigenschaft menschliche Arbeit zu sein In der
8885,81,daher die allgemeine Eigenschaft menschlicher Arbeit und mögen daher in
8939,58,seiner allgemeinen Eigenschaft als menschliche Arbeit den Leinwandwerth bildet wird
8949,70,ihm die Schneiderei die konkrete Arbeit die das Leinwand Aequivalent
8962,84,die handgreifliche Verwirklichungsform abstrakt menschlicher Arbeit Es ist also eine
9014,63,Erstes Kapitel Die Ware krete Arbeit zur Erscheinungsform ihres Gegentheils
9022,76,ihres Gegentheils abstrakt menschli cher Arbeit wird Indem aber diese
9028,95,wird Indem aber diese konkrete Arbeit die Schneiderei als bloßer
9036,113,als bloßer Ausdruck unterschiedsloser menschlicher Arbeit gilt besitzt sie die
9046,130,Form der Gleichheit mit andrer Arbeit der in der Leinwand
9052,148,der in der Leinwand steckenden Arbeit und ist daher obgleich
9063,164,wie alle andre Waaren producirende Arbeit dennoch Arbeit in unmittelbar
9065,184,andre Waaren producirende Arbeit dennoch Arbeit in unmittelbar gesellschaftlicher Form
9096,158,Eigenthümlichkeit der Aequivalentform daß Privat arbeit zur Form ihres Gegentheils
9103,174,Form ihres Gegentheils wird zu Arbeit in unmittelbar gesellschaftlicher Form
9404,20,vorstellt Und das ist menschliche Arbeit Erster Abschnitt Ware und
9418,32,der Form der Waarenwerthe alle Arbeiten als gleiche menschliche Arbeit
9422,51,alle Arbeiten als gleiche menschliche Arbeit und daher als gleichgeltend
9467,47,und gleiche 28 Gültigkeit aller Arbeiten weil und insofern sie
9473,63,weil und insofern sie menschliche Arbeit überhaupt sind kann nur
10040,20,der Produktion eines Gebrauchsdings verausgabte Arbeit als seine gegenständliche Eigenschaft
10643,20,wahrhaft als Gallerte unterschiedsloser menschlicher Arbeit Denn die ihn bildende
10648,29,Arbeit Denn die ihn bildende Arbeit ist nun ausdrücklich als
10653,48,Arbeit ist nun ausdrücklich als Arbeit dargestellt der jede andre
10659,67,dargestellt der jede andre menschliche Arbeit gleichgilt welche Naturalform sie
10902,20,besondre Verwirklichungs oder Erscheinungsformen menschlicher Arbeit schlechthin 3 Mängel der
11067,20,nicht erschöpfende Erscheinungsform der menschlichen Arbeit Diese besitzt ihre vollständige
11816,20,l A so viel Werthsubstanz Arbeit als in 1 Pfd
11875,20,allgemeine gesellschaftliche Verpuppung aller menschlichen Arbeit Die Weberei die Privatarbeit
11897,34,der Gleichheit mit allen andren Arbeiten Die zahllosen Gleichungen woraus
11917,46,der Leinwand verwirk 25 lichte Arbeit jeder in andrer Waare
11923,63,jeder in andrer Waare enthaltenen Arbeit gleich und machen dadurch
11934,79,Weberei zur allgemeinen Erscheinungsform menschlicher Arbeit überhaupt So ist die
11942,97,ist die im Waarenwerth vergegenständlichte Arbeit nicht nur negativ dargestellt
11948,116,nicht nur negativ dargestellt als Arbeit worin von allen konkreten
11959,131,und nützlichen Eigenschaften der wirklichen Arbeiten abstrahirt wird Ihre 30
11976,137,ist die Reduktion aller wirklichen Arbeiten auf den ihnen gemeinsamen
11983,154,den ihnen gemeinsamen Charakter menschlicher Arbeit auf die Verausgabung menschlicher
12000,159,als bloße Gallerten unterschiedsloser menschlicher Arbeit darstellt zeigt durch ihr
12029,140,der allgemein menschliche Charakter der Arbeit ihren specifisch gesellschaftlichen Charakter
13254,20,als Produkt menschli 10 eher Arbeit erhält Es ist sinnenklar
13381,20,erstens wie verschieden die nützlichen Arbeiten oder produktiven Thätigkeiten sein
13442,20,Verausgabung oder die Quantität der Arbeit so ist die Quantität
13453,36,sinnfällig von der Qualität der Arbeit unterscheidbar In allen Zuständen
13487,42,irgend einer Weise für einander arbeiten erhält ihre Arbeit auch
13490,61,für einander arbeiten erhält ihre Arbeit auch eine gesellschaftliche Form
13537,53,eines Morgens Land nach der Arbeit eines Tages berechnet und
13610,20,selbst Die Gleichheit der menschlichen Arbeiten erhält die sachliche Form
13649,25,worin jene gesellschaftlichen Bestimmungen ihrer Arbeiten bethätigt werden erhalten die
13677,35,die gesellschaftlichen Charaktere ihrer eignen Arbeit als gegenständliche Charaktere der
13911,20,dem eigenthümlichen gesellschaftlichen Charakter der Arbeit welche Waaren producirt Gebrauchsgegenstände
14007,20,die gesellschaftlichen Beziehungen ihrer Privat arbeiten als das was sie
14024,35,Verhältnisse der Personen in ihren Arbeiten selbst sondern vielmehr als
14120,20,müssen einerseits als bestimmte nützliche Arbeiten ein bestimmtes ge 20
14142,33,Systems der gesellschaftlichen Theilung der Arbeit bewähren Sie befriedigen andrerseits
14176,39,Die Gleichheit toto coelo verschiedner Arbeiten kann nur in einer
14202,47,Verausgabung menschlicher Arbeitskraft abstrakt menschliche Arbeit besitzen Das Gehirn der
14256,34,der Gleichheit 43 der verschiedenartigen Arbeiten in der 35 Form
14291,39,bloß sachliche Hüllen gleichartig menschlicher Arbeit gelten Umgekehrt Indem sie
14314,48,Erstes Kapitel Die Ware verschiednen Arbeiten einander als menschliche Arbeit
14318,67,verschiednen Arbeiten einander als menschliche Arbeit gleich Sie wissen das
14407,20,ihrer Produk tion verausgabten menschlichen Arbeit sind macht Epoche in
14426,34,Schein der gesellschaftlichen Charaktere der Arbeit Was nur für diese
14454,43,in ihrer Gleichheit als menschliche Arbeit besteht und die Form
14715,20,Ware und Geld lung der Arbeit allseitig von einander abhängigen
14971,20,die allgemeine Verkörperung abstrakter menschlicher Arbeit so springt die Verrücktheit
15164,20,befriedigen und muß daher nützliche Arbeiten verschiedner Art verrichten Werkzeuge
15221,20,also nur verschiedne Weisen menschlicher Arbeit sind Die Noth selbst
15544,20,Getriebe ein Die Naturalform der Arbeit ihre Besonderheit und nicht
15576,25,wie die Waaren producirende 5 Arbeit aber jeder Leibeigne weiß
15634,20,nisse der Personen in ihren Arbeiten erscheinen jedenfalls als ihre
15661,31,gemeinsamer d h unmittelbar vergesellschafteter Arbeit brauchen wir nicht zurückzugehn
15729,20,wechselseitig als Waaren Die verschiednen Arbeiten welche diese Produkte erzeugen
15758,31,ihre eigne naturwüchsige Theilung der Arbeit besitzt so gut wie
15780,43,der Jahreszeit wechselnden Naturbedingungen der Arbeit regeln ihre Vertheilung unter
15969,20,vor die mit gemeinschaftlichen Produktionsmitteln arbeiten und ihre vielen individuellen
15986,33,Alle Bestimmungen von Robinson s Arbeit wiederholen sich hier nur
16088,20,Lebensmitteln sei bestimmt durch seine Arbeits zeit Die Arbeitszeit würde
16145,20,Beziehungen der Menschen zu ihren Arbeiten und ihren Arbeitsprodukten bleiben
16197,20,zu beziehn als gleiche menschliche Arbeit ist das Christenthum mit
16349,20,Entwicklungs stufe der Produktivkräfte der Arbeit und entsprechend befangene Verhält
16512,20,annimmt warum sich also die Arbeit im Werth und das
16519,36,Werth und das Maß der Arbeit durch ihre Zeitdauer in
16573,27,und mit klarem Bewußtsein die Arbeit wie sie sich im
16581,44,sich im Werth von derselben Arbeit soweit sie sich im
16600,55,thatsächlich 25 da sie die Arbeit das einemal quantitativ das
16619,64,daß bloß quantitativer Unterschied der Arbeiten ihre qualitative Einheit oder
16632,76,ihre Reduktion auf abstrakt menschliche Arbeit Ricardo z B erklärt
16779,20,die den Reichthum bilden die Arbeit repräsentiren die sie geschaffen
16799,33,und Tauschwerth vom Werth der Arbeit erhalten Er fällt damit
16816,47,Werth einer Waare hier der Arbeit voraussetzt um dadurch hinterher
16840,54,im Gebrauchswerth als Tauschwerth sich Arbeit nicht Werth der Arbeit
16844,73,sich Arbeit nicht Werth der Arbeit darstellt Er selbst aber
16856,88,wenig den zwieschlächtigen Charakter der Arbeit die doppelt dargestellt ist
16900,72,zwar mit ihm selbst über Arbeit als Werthquelle und dennoch
16958,46,ständliche Naturnothwendigkeit als die produktive Arbeit selbst Vorbürgerliche Formen des
17058,20,liegt tiefer Die Werthform des Arbeits 15 produkts ist die
17601,20,die auf ein Ding verwandte Arbeit auszudrücken kann er nicht
18398,20,als bloße Ausdrücke 35 menschlicher Arbeit Wenn die Ricardianer dem
19049,20,die auf sie verausgabte menschliche Arbeit zählt nur soweit sie
20242,20,sich daher zur Materiatur menschlicher Arbeit überhaupt ausweitet geht die
20334,20,abstrakter und daher gleicher menschlicher Arbeit kann nur eine Materie
20723,20,Charaktere welche gesellschaftliche Bestimmungen der Arbeit auf Grundlage einer bestimmten
21870,20,die unmittelbare Inkarnation aller menschlichen Arbeit Daher die Magie des
22024,20,Waaren als Werthe vergegenständlichte menschliche Arbeit daher an und für
22386,20,Privatarbeit nicht als unmittelbar gesellschaftliche Arbeit als ihr Gegentheil behandelt
22433,20,Theatermarke Owen setzt unmittelbar vergesellschaftete Arbeit voraus eine der Waarenproduktion
22732,20,h das Quantum 10 menschlicher Arbeit das z B in
22752,31,Quantum der Geldwaare welches gleichviel Arbeit enthält Je nachdem also
23373,20,gesellschaftli che Inkarnation der menschlichen Arbeit Maßstab der Preise als
23882,20,ten Goldquantums ein gegebnes Quantum Arbeit kostet In Bezug auf
24691,20,der in der Waare vergegenständlichten Arbeit Die Aequivalenz der Waare
24760,20,ihrer Werthgröße ist Gesellschaftlich nothwendige Arbeit von gleicher 20 Größe
25192,20,Produktionsbedingungen oder gleichbleibender Produktivkraft der Arbeit muß nach wie vor
25455,20,Werth hat weil keine menschliche Arbeit in ihm vergegenständlicht ist
26488,20,gegen Waare Stoffwechsel der gesellschaftlichen Arbeit in dessen Resultat der
26543,20,Waarenbesitzer Die gesellschaftliche Theilung der Arbeit macht seine Arbeit ebenso
26546,39,Theilung der Arbeit macht seine Arbeit ebenso einseitig als seine
26599,30,sein die auf sie verausgabte Arbeit also in gesellschaftlich nützlicher
26616,44,Glied der gesellschaftlichen Theilung der Arbeit bewähren Aber die Theilung
26622,62,bewähren Aber die Theilung der Arbeit ist ein naturwüchsiger Produktionsorganismus
26682,41,Waarenproducenten reißt sich eine besondre Arbeits Verrichtung heute 65 de
26801,20,Platze verdrängt Ist auch die Arbeit wie die unsres Leinwebers
26961,20,in ihr vergegenständlichten Quantums gesellschaftlicher Arbeit Aber ohne Erlaubniß und
27144,20,gesellschaftlich bestimmten Quantums gleichartiger menschlicher Arbeit 40 Man sieht die
27193,20,im System der Theilung der Arbeit darstellt Unsere Waarenbesitzer entdecken
27203,37,daher daß dieselbe Theilung der Arbeit die sie zu unabhängigen
27241,40,Abhängigkeit ergänzt Die Theilung der Arbeit verwandelt das Arbeitsprodukt in
27496,20,ein Verhältniß worin sie fremdes Arbeits produkt nur aneignen indem
27737,20,brauchswerths und der besondren nützlichen Arbeit ab welcher sie den
27753,33,gleichförmige gesellschaftliche Materiatur unterschiedsloser menschlicher Arbeit zu verpuppen Man sieht
28833,20,und den Stoffwechsel der menschlichen Arbeit entwik71 Il y a
29346,20,Gebrauchswerth und Werth von Privat arbeit die sich zugleich als
29353,30,sich zugleich als unmittelbar gesellschaftliche Arbeit darstellen muß von besondrer
29359,49,darstellen muß von besondrer konkreter Arbeit die zugleich nur als
29366,67,zugleich nur als abstrakt allgemeine Arbeit gilt von Personificirung der
33213,20,einer Apotheose der Theilung der Arbeit Hinterher 35 im letzten
33236,20,Lehrers Denunciation der Theilung der Arbeit 79 The prices of
34951,20,für die Krone vortheilhaft ist Arbeiten der Kaiserlich Russischen Gesandtschaft
36968,20,unmittelbar gesellschaftliche Inkarnation aller menschlichen Arbeit Der 91 Gold yellow
38963,20,die individuelle Inkarnation der gesellschaftlichen Arbeit selbständiges Dasein des Tauschwerths
40571,20,gesellschaftliche Ver11117 wirklichungsform der menschlichen Arbeit in abstracto ist Seine
41619,20,der in edlen Metallen realisirten Arbeit der Gold und Silber
43521,20,Stoffe worin sich die gesellschaftliche Arbeit darstellt bildet hier den
46922,20,h dasselbe Quantum vergegenständlichter gesellschaftlicher Arbeit bleibt in der Hand
50017,20,Gesetzen gemessenes Quantum seiner eignen Arbeit enthält Dieß Quantum Arbeit
50021,20,eignen Arbeit enthält Dieß Quantum Arbeit drückt sich 34 Benjamin
50107,20,B 10Pfd St Aber seine Arbeit stellt sich nicht dar
50151,21,Waarenbesitzer kann 5 durch seine Arbeit Werthe bilden aber keine
50174,34,Werth neuen Werth durch neue Arbeit zusetzt z B aus
50796,20,Verbrauch also selbst Vergegenständlichung von Arbeit wäre daher Werthschöpfung Und
51006,20,war außer daß der freie Arbeiter und das Kreditwesen fehlten
51188,20,zu können worin sich seine Arbeit vergegenständlicht hat 15 vielmehr
51336,20,Alle Gesetzbücher bei Völkern freier Arbeit regeln Kündigungsbedingungen des Kontrakts
51384,20,versteckt Durch Vorschüsse die in Arbeit abzutragen und sich von
51398,36,wird nicht nur der einzelne Arbeiter sondern seine Familie thatsächlich
51488,20,Veräußerung meiner ganzen durch die Arbeit konkreten Zeit und der
51542,20,der Geldbesitzer also den freien Arbeiter auf dem Waarenmarkt vorfinden
51591,20,Die Frage warum dieser freie Arbeiter ihm in der Cirkulationssphäre
51839,20,so weit entwickelte Theilung der Arbeit innerhalb der Gesellschaft daß
51971,20,Produktions und Lebensmitteln den freien Arbeiter 5 als Verkäufer seiner
52147,20,ihres Besitzers nothwendigen Lebensmittel Die Arbeits 25 kraft verwirklicht sich
52162,34,bethätigt sich nur in der Arbeit Durch ihre Bethätigung die
52167,53,Arbeit Durch ihre Bethätigung die Arbeit wird aber ein bestimmtes
52226,35,Lebensmittel muß also hinreichen das arbeitende Individuum als arbeitendes In
52229,54,hinreichen das arbeitende Individuum als arbeitendes In 41 Was also
52244,67,daß die Arbeitskraft für den Arbeiter selbst die Form einer
52253,83,einer ihm gehörigen Waare seine Arbeit daher die Form der
52336,24,empfing daher weil er leichtere Arbeit hat als die Knechte
52438,20,ensansprüchen die Klasse der freien Arbeiter sich gebildet hat44 Im
52561,20,d h der Kinder der Arbeiter so daß sich diese
52759,20,1815 p 62 Das Wort Arbeit steht hier fälschlich für
