x,y,quote
131042,86,Kapitalist in der Theilung der Arbeit a priori ausübe findet
131067,81,dessen Jupiterhaupt die Theilung der Arbeit fertig hervorspringe zum Dank
131083,88,geringre Anwendung der Theilung der Arbeit hängt von der Länge
131121,76,betrachtet die gesellschaftliche Theilung der Arbeit überhaupt nur vom Standpunkt
131136,83,als Mittel mit demselben Quantum Arbeit mehr Waare zu produciren
131220,23,verbessert durch die Theilung der Arbeit Wird gelegentlich auch das
131292,20,Charakter der manufakturmäßigen Theilung der Arbeit 77 Ausnahme unter den
131310,35,in Bezug auf Theilung der Arbeit fast nur den Alten
131570,20,a die der Theilung der Arbeit gegenüber steht pa t
131610,21,Plato entwickelt die Theilung der Arbeit innerhalb des Gemeinwesens aus
131631,35,Hauptgesichtspunkt bei ihm daß der Arbeiter sich nach dem Werk
131643,50,nicht das Werk nach dem Arbeiter was unvermeidlich wenn er
131695,39,e Zwölftes Kapitel Teilung der Arbeit und Manufaktur der Arbeit
131699,58,der Arbeit und Manufaktur der Arbeit 370 als Grundlage der
131722,65,Instikt schon der Theilung der Arbeit innerhalb einer Werkstatt näher
131883,20,Werk sagt Plato auf den Arbeiter warten so wird oft
131924,22,eine bestimmte Eßstunde für alle Arbeiter festsetzt Ihr Geschäft könne
131933,40,könne sich nicht nach den Arbeitern richten denn in the
132165,20,daß der Verrichter der einfachsten Arbeit sie unbedingt auch am
132341,20,neben der hierarchischen Gliederung der Arbeiter eine einfache Scheidung zwischen
132349,35,Scheidung zwischen geschickten und ungeschickten Arbeitern schafft bleibt die Zahl
132406,23,und dem Widerstand der männlichen Arbeiter Obgleich die Zersetzung der
132420,39,und daher den Werth der Arbeiter senkt bleibt für schwieri
132443,50,vom Ueberfluß eifersüchtig von den Arbeitern aufrecht erhalten Wir finden
132495,38,Gesammtmechanismus 113721 kein von den Arbeitern selbst unabhängiges ob jektives
132510,51,beständig mit der Insubordination der Arbeiter Die Schwäche der menschlichen
132525,63,ist so groß daß der Arbeiter je geschickter desto eigenwilliger
132608,20,der Ein oder Auswandrung der Arbeiter ihren Sitz in dem
132673,20,scholastischen Dogma der Theilung der Arbeit beruhenden Manufaktur und Arkwright
132804,20,dem Auge die Theilung der Arbeit in ihren mannigfachen Abstufungen
132816,36,Drechselbank hatten jede ihre eignen Arbeiter hierarchisch gegliedert nach dem
132831,50,der 10 manufakturmäßigen Theilung der Arbeit producirte seinerseits Maschinen 373
132859,55,Grund der lebenslangen Annexation des Arbeiters an eine Theilfunktion weggeräumt
132935,20,andren Entwicklung der Produktivkraft der Arbeit soll sie Waaren verwohlfeilern
132948,36,des Arbeitstags den der 25 Arbeiter für sich selbst braucht
133242,20,von der Hand eines einzigen Arbeiters bewegt 96 000 Maschen
134038,20,Operationen verrichtet welche früher der Arbeiter mit ähnlichen Werkzeugen verrichtete
134141,20,Händen und 377 zwei Füßen arbeiten zu lassen Dies war
134220,20,Schranke wodurch das Handwerkszeug eines Arbeiters beengt wird 25 An
134238,35,als bloßer Triebkraft und als Arbeiter mit dem eigentlichen Operateur
134291,26,dem Menschen neben der neuen Arbeit die Maschine mit seinem
134701,20,Revolution ausgeht ersetzt den 30 Arbeiter der ein einzelnes Werkzeug
135355,20,Dampfmaschine zu verrichten müßten 66 Arbeiter per Stunde zu zusammen
136006,20,Manufaktur von Enveloppes faltete ein Arbeiter das Papier mit dem
136160,20,zunächst wir sehn hier vom Arbeiter ab als räumliche Konglomeration
136182,32,sondern vielmehr eine komplicirte handwerksmäßige Arbeit und so ist der
136215,39,welche die manufakturmäßige Theilung der Arbeit vereinfacht hatte Spinnen und
136249,43,handwerksmäßig Es ist nicht die Arbeit sondern das Arbeitsmittel wovon
136400,20,eigenthümliche Kooperation durch Theilung der Arbeit wieder aber jetzt als
136493,20,ein In der Manufaktur müssen Arbeiter vereinzelt oder in Gruppen
136725,20,des relativen Mehrwerts Wird der Arbeiter dem Proceß angeeignet so
136737,34,auch vorher der Proceß dem Arbeiter angepaßt Dies subjektive Princip
136956,20,ein durch die Theilung der Arbeit selbst gegebnes Princip ist
137041,20,für gewisse Bewegungen noch den Arbeiter brauchen wie die zum
137077,26,Werks gleich einem Werkzeug vom Arbeiter gelenkt werden müssen wie
137380,20,u s w bevor es Arbeiter gab deren ausschließliches Geschäft
137432,20,und beträchtliches Quantum geschickter mechanischer Arbeiter vorfanden Ein Theil dieser
137437,38,Arbeiter vorfanden Ein Theil dieser Arbeiter bestand aus selbständigen Handwerkern
137460,50,früher erwähnt die Theilung der Arbeit mit besondrer Strenge waltete
137498,49,Zweige andrerseits die Theilung der Arbeit im Innern der maschinenbauenden
138038,20,durch die gesellschaftliche Theilung der Arbeit isolirt sind so daß
138178,20,erweiterten Thei lung der gesellschaftlichen Arbeit ihrer Koncentration von Arbeitsmitteln
138184,37,ihrer Koncentration von Arbeitsmitteln und Arbeitern und ihren Kolonialmärkten durchaus
138604,20,Erfahrung der Hand des geschicktesten Arbeiters verleihen konnte 105 Betrachten
138937,20,objektiven Produktionsorganismus 20 den der Arbeiter als fertige materielle Produktionsbedingung
138953,32,in der durch Theilung der Arbeit specificirten Kooperation erscheint die
138961,49,erscheint die Verdrängung des vereinzelten Arbeiters durch den vergesellschafteten immer
138989,55,Hand unmittelbar vergesellschafteter oder gemeinsamer Arbeit Der kooperative Charakter des
139024,54,aus Kooperation und Theilung der Arbeit entspringen 30 den Produktivkräfte
139038,65,Sie sind Naturkräfte der gesellschaftlichen Arbeit Naturkräfte wie Dampf Wasser
139105,33,Hufeisen 107 Die in Holz arbeitenden Maschinen die auch auf
139250,20,Handwerkszeug läßt das Kapital den Arbeiter jetzt mit einer Maschine
139255,37,Arbeiter jetzt mit einer Maschine arbeiten die ihre Werkzeuge selbst
139289,43,den Produktionsproceß die Produktivität der Arbeit außerordentlich steigern muß ist
139504,20,dem Kapital einverleibt wie fremde Arbeit Kapitalistische Aneignung und persönliche
139708,20,ganz wie ohne Zuthun menschlicher Arbeit vorhandne Naturkräfte Um so
139752,20,dukt seiner vergangnen bereits vergegenständlichten Arbeit 393 auf großem Maßstab
140253,20,13951 Werthgröße ab110 Je weniger Arbeit sie selbst enthält desto
140627,20,klar daß bloßes Deplacement der Arbeit stattfindet also die Gesammtsumme
140638,32,zur Produktion einer Waare erheischten Arbeit nicht vermindert oder die
140645,50,vermindert oder die Produktivkraft der Arbeit nicht vermehrt wird wenn
140657,65,Produktion einer Maschine so viel Arbeit kostet als ihre Anwendung
140668,80,Die Differenz jedoch zwischen der Arbeit die sie kostet und
140674,99,die sie kostet und der Arbeit die sie erspart oder
140730,70,als der Werth den der Arbeiter mit seinem zusehn daß
141174,20,365¾ Pfd Garn von 2 Arbeitern gesponnen Bei ihrer Verwandlung
141332,20,mit Einschluß von mehr unbezahlter Arbeit zu 10 cents verkauft
141477,20,203 Werkzeugmaschinen und circa 2400 Arbeitern 13 Millionen 35 Pfund
141487,36,Gußstahl Hier noch nicht 2 Arbeiter auf 1 Pferdekraft 113
141519,43,der Gesammtwerth den Maschinerie und Arbeit der Baumwolle bei der
141632,20,von den 66 Menschen zugefügten Arbeit War das Verhältniß von
141640,37,Verhältniß von Mehrarbeit zu nothwendiger Arbeit 100 so producirten diese
141646,55,100 so producirten diese 66 Arbeiter per Stunde einen Werth
141691,50,von 150 durch sie verdrängten Arbeitern sage 3000 Pfd St
141707,60,der Geldausdruck der von 150 Arbeitern gelieferten und dem Arbeitsgegenstand
141713,78,gelieferten und dem Arbeitsgegenstand zugesetzten Arbeit sondern nur des Theils
141744,75,während ihrer 15 Produktion verausgabte Arbeit aus in welchem Verhältniß
141751,91,in welchem Verhältniß immer diese Arbeit Arbeitslohn für den Arbeiter
141755,111,diese Arbeit Arbeitslohn für den Arbeiter und Mehrwerth für den
141780,107,die in ihr selbst vergegenständlichte Arbeit stets viel kleiner als
141815,90,daß ihre eigne Produktion weniger Arbeit kostet als ihre Anwendung
141820,107,Arbeit kostet als ihre Anwendung Arbeit ersetzt Für das Kapital
141837,115,Da es nicht die angewandte Arbeit zahlt sondern den Werth
141844,132,sondern den Werth der angewandten Arbeits 25 kraft wird ihm
141873,119,Theilung des Arbeitstags in nothwendige Arbeit und Mehrarbeit in verschiednen
141903,104,ferner der wirkliche Lohn des Arbeiters bald unter den Werth
141954,74,Gesammtquantum der von ihr ersetzten Arbeit dieselbe bleibt116a Es ist
142147,20,der angewandten sondern der bezahlten Arbeit entspringt überflüssig oft unmöglich
142225,20,Maschinerie117 Vor dem Verbot der Arbeit von Weibern und Kindern
142306,20,für den Agrikulturarbeiter der diese Arbeit verrichtet einen so geringen
142313,37,einen so geringen Theil seiner Arbeit bezahlt erhält daß Maschinerie
142354,39,Pferden und 30 Maschinen erheischte Arbeit ein mathematisch gegebenes Quantum
142572,20,des maschinenmäßigen Betriebs auf den Arbeiter Den Ausgangspunkt der großen
142618,20,Rückwirkungen jener Revolution auf den Arbeiter selbst a Aneignung zuschüssiger
142640,34,macht wird sie zum Mittel Arbeiter ohne Muskelkraft oder von
142670,42,Maschinerie Dies gewaltige Ersatzmittel von Arbeit und Arbeitern verwandelte sich
142672,61,gewaltige Ersatzmittel von Arbeit und Arbeitern verwandelte sich damit sofort
142722,50,Kinderspiels sondern auch der freien Arbeit im häuslichen Kreis innerhalb
142790,20,abgesehn von der Verbannung der Arbeiter aus der Fabrikatmosphäre vielerlei
142871,20,eignen Schulen die Töchter der Arbeiter nähen zu lehren Eine
142904,28,Mehrwerts tung des individuellen erwachsnen Arbeiters sondern durch die zur
142996,20,Vier müssen nun nicht nur Arbeit sondern Mehrarbeit für das
143042,20,des Kapitalverhältnisses den Kontrakt zwischen Arbeiter und Kapitalist 15 Auf
143058,36,Voraussetzung daß sich Kapitalist und Arbeiter als freie Personen als
143087,44,Kapital Unmündige oder Halbmündige Der Arbeiter verkaufte früher seine eigne
143218,20,oder minder Stellvertreter dingen Die Arbeiten welche der Familienkonsum erheischt
143242,32,verminderten Ausgabe 30 von häuslicher Arbeit entspricht also vermehrte Geldausgabe
143327,20,Fabriken von den erwachsnen männlichen Arbeitern dem Kapital ab erobert
143385,20,die er sonst Freiheit der Arbeit tauft Infant labour has
143541,20,13 Jahren nur 6 Stunden arbeiten dürfen Ein amtlich qualificirter
143930,20,verkaufen wo noch Freiheit der Arbeit herrscht d h wo
143944,31,gezwungen werden wie Erwachsne zu arbeiten also auch theurer loszuschlagen
143970,42,der Exploitationsbe 5 dingungen der Arbeit als sein angebornes Menschenrecht
144470,20,mit Mädchen und Jungen zusammen arbeiten werden dem Pächter von
144666,20,in irgend einer Fabrik zu arbeiten 135 13 I e
144723,20,der Opiumkonsum unter den erwachsnen Arbeitern und Arbeiterinnen täglich aus
144833,20,Engels in seiner Lage der arbeitenden Klassen Englands und von
145983,20,den Widerstand den der männliche Arbeiter in der Manufaktur der
146230,20,Mittel ist die Produktivität der Arbeit zu steigern d h
146299,20,Wetzung seines Heißhungers nach fremder Arbeit 10 Zunächst verselbständigt sich
146315,36,Werkthätigkeit des Arbeitsmittels gegenüber dem Arbeiter Es wird an und
146385,20,durch die scheinbare Leichtigkeit der Arbeit an der Maschine und
147312,20,sein Kontakt mit der lebendigen Arbeit unterbrochen wird Wenn belehrte
147725,20,Einführung die vom Maschinenbesitzer verwandte Arbeit in potenzirte Arbeit verwandelt
147728,34,Maschinenbesitzer verwandte Arbeit in potenzirte Arbeit verwandelt den 5 gesellschaftlichen
147886,20,die Anzahl der gleichzeitig beschäftigten Arbeiter Bei gegebner Länge des
147906,33,worin der Arbeitstag in nothwendige Arbeit und Mehrarbeit zerfällt Die
147915,49,Die Anzahl der gleichzeitig beschäftigten Arbeiter hängt ihrerseits ab von
147945,55,Steigrung der Produktivkraft der 415 Arbeit die Mehrarbeit auf Kosten
147952,71,Mehrarbeit auf Kosten der nothwendigen Arbeit ausdehne dies Resultat nur
147968,82,von einem gegebnen Kapital beschäftigten Arbeiter vermindert Er verwandelt einen
148005,72,unmöglich z B aus zwei Arbeitern so viel Mehrwerth auszupressen
148017,83,24 Wenn jeder der 24 Arbeiter auf 12 Stunden nur
148083,47,Fabrik mehr oder weniger Zeit arbeite z B Rente für
148099,58,Feuerversichrung Arbeitslohn für verschiedne permanente Arbeiter Verschlechtrung der Maschinerie nebst
148153,43,während die Gesammtarbeit der zwei Arbeiter nur 24 Stunden beträgt
148268,20,der verhältnißmäßigen Anzahl der exploitirten Arbeiter durch Zunahme nicht nur
148344,20,der von der Maschine verdrängten Arbeiter eine überflüssige Arbeiterpopulation154 die
148403,20,Mittel umschlägt alle Lebenszeit des Arbeiters und seiner Familie in
148459,20,eignem Antrieb an die heilige Arbeit gingen wenn so die
148694,20,christliche Organ c Intensifikation der Arbeit Die maßlose Verlängrung des
148751,20,Wichtigkeit nämlich die Intensifikation der Arbeit Bei der Analyse des
148769,35,exten 20 sive Größe der Arbeit während der Grad ihrer
148819,29,und damit die Intensität der Arbeit naturwüchsig zunehmen So geht
148862,29,früheren Citate über Theilung der Arbeit den Gegensatz der antiken
148891,39,Morgen umsonst Däo hat die Arbeit der Mädchen den Nymphen
148973,20,begreift man daß bei einer Arbeit wo es sich nicht
149002,30,des Arbeitstags und Intensität der Arbeit einander ausschlie5 ßen so
149017,45,nur mit schwächrem Intensitätsgrad der Arbeit und umgekehrt ein erhöhter
149122,20,darin durch gesteigerte Produktivkraft der Arbeit den Arbeiter zu befähigen
149124,39,gesteigerte Produktivkraft der Arbeit den Arbeiter zu befähigen mit derselben
149211,20,Arbeitszeit d h Kondensation der Arbeit dem Arbeiter zu einem
149213,39,h Kondensation der Arbeit dem Arbeiter zu einem Grad aufzwingt
149231,52,Diese Zusammenpressung einer größren Masse Arbeit in eine gegebne Zeitperiode
149272,49,jetzt so viel oder mehr Arbeit d h verausgabte Arbeitskraft
149313,45,durch die gesteigerte Produktivkraft der Arbeit liefern jetzt z B
149328,56,Unterschiede in der Intensität der Arbeiten verschiedner Produktionszweige statt Diese
149391,32,Mehrarbeit auf 6 Stunden nothwendiger Arbeit dem Kapita listen dieselbe
149407,46,auf 8 Stun den nothwendiger Arbeit Es fragt sich nun
149415,62,sich nun wie wird die Arbeit intensificirt Die erste Wirkung
149462,54,Dauer verloren geht Daß der Arbeiter aber auch wirklich mehr
149514,39,Ordnung Kontinuität und Energie der Arbeit wundervoll erhöht159 Diese Wirkung
149531,51,Fabrik weil die Abhängigkeit des Arbeiters von der kontinuirlichen und
149588,34,und Aufmerksamkeit auf Seiten der Arbeiter the extent of vigilance
149635,30,Aufmerksamkeit u s w der Arbeiter irgend ein erkleckliches Resultat
149673,34,noch 11 Stunden per Tag arbeiten Nach ungefähr Jahresfrist ergab
149693,46,Kosten erhalten ward und sämmtliche Arbeiter in 11 Stunden eben
149840,20,zwölfstündigem Arbeitstag wöchentlicher Durchschnittslohn jedes Arbeiters 10 sh Vf2 d
149882,22,Folge größrer gleichmäßiger Ausdauer der Arbeiter und Oekonomie ihrer Zeit
149944,20,subjektive Bedingung der Kondensation der Arbeit schafft nämlich die Fähigkeit
149950,38,schafft nämlich die Fähigkeit des Arbeiters mehr Kraft in gegebner
149977,48,und systematisch angewandten Mittel mehr Arbeit in derselben Zeit zu
150000,56,erweiterten Umfang der von demselben Arbeiter zu überwachenden Maschinerie oder
150023,62,des größren Drucks auf den Arbeiter theils begleitet sie von
150032,76,von selbst die Intensiflkation der Arbeit weil die Schranke des
150180,20,erwähnten Experimenten We erklärten die Arbeiter dem Fabrikinspektor we work
150282,20,mit früher 5 ist die Arbeit die in den Fabriken
150306,32,vermehrte Geschwindigkeit der Maschinerie vom Arbeiter erheischt 164 Im Jahr
150328,44,Hause der Gemeinen 10 Die Arbeit der in den Fabrikprocessen
150368,43,hat auch erstaunlich prodigiously die Arbeit der durch ihre furchtbare
150379,57,beherrschten Menschen 15 vermehrt Die Arbeit einem Paar Mules während
150516,20,worin nachgewiesen wird daß die Arbeit progressiv zunimmt nicht nur
150554,25,Baumwolle gesponnen wird die mehr Arbeit erfordert Im Kardirraum hat
150563,42,hat auch große Zunahme der Arbeit stattgefunden Eine Person thut
150570,60,Eine Person thut jetzt die Arbeit die früher zwischen zwei
150592,68,Geschlechts beschäftigt ist ist die Arbeit während der letzten 35
150669,21,was einen großen Zuwachs von Arbeit anzeigt 165 Angesichts dieser
150678,38,dieser merkwürdigen Intensität welche die Arbeit unter der Herrschaft des
150788,20,fabricirten Artikels und Fähigkeit des Arbeiters der Bewegung zu folgen
150874,20,daß der per Stücklohn bezahlte Arbeiter sich aufs äußerste anstrengt
151551,20,in 5 tensivre Anstrengung des Arbeiters bewirkten daß wenigstens eben
151837,20,Ge 30 sammtzahl der beschäftigten Arbeiter ab die der exploitirten
151873,23,haben mir mitgetheilt daß die Arbeit in den 35 Fabriken
151921,21,u s w Zwölf Stunden Arbeit wie aus den 40
152039,20,bereits eine die Gesundheit der Arbeiter also die Arbeitskraft selbst
152047,36,Arbeitskraft selbst zerstörende Intensität der Arbeit hervorgerufen habe In den
152067,49,Aufregung nöthig 10 für die Arbeit an der Maschinerie deren
152134,21,systematische Steigrung des Intensitätsgrads der Arbeit gütlich zu thun und
152164,32,muß wo abermalige Abnahme der Arbeits 20 stunden unvermeidlich wird177
152863,20,in jedem Zeitmo ment mehr Arbeit flüssig zu machen oder
152901,20,als Kooperation verschiedner Klassen von Arbeitern erwachsnen und nicht erwachsnen
153007,20,selbst das Subjekt und die Arbeiter 20 sind nur als
153100,20,in seiner Führung 30 vom Arbeiter auf die Maschine über
153127,31,aufgehoben worauf die Theilung der Arbeit in der Manufaktur beruht
153141,46,sie charakterisirenden Hierarchie der specialisirten Arbeiter tritt daher in der
153157,58,der Gleichmachung oder Nivellirung der Arbeiten welche die Gehülfen der
153223,29,automatischen Fabrik die Theilung der Arbeit wiedererscheint ist sie zunächst
153230,47,ist sie zunächst Vertheilung von Arbeitern unter die specialisirten Maschinen
153260,53,ben einander gereihten gleichartigen Werkzeugmaschinen arbeiten also nur einfache Kooperation
153289,57,wesentliche Scheidung ist die von Arbeitern die wirklich an den
153302,69,es kommen 10 hiezu einige Arbeiter zur Bewachung resp Füttrung
153384,20,nur aggregirt181 Diese Theilung der Arbeit ist rein technisch 20
153391,37,rein technisch 20 430 Alle Arbeit an der Maschine erfordert
153399,55,Maschine erfordert frühzeitige Anlernung des Arbeiters damit er seine eigne
153458,37,befestigen durch fortwährende Aneignung derselben Arbeiter an dieselbe Funktion182 Da
153469,52,Gesammtbewegung der Fabrik nicht vom Arbeiter ausgeht sondern von 30
153509,50,die zuletzt im Text erwähnten Arbeiter ausdrücklich als Nicht Fabrikarbeiter
153568,30,zu Er sagt daß die Arbeiter im Nothfall nach dem
153601,37,der alten Routine die die Arbeit theilt und dem einen
153606,55,Arbeit theilt und dem einen Arbeiter die Aufgabe zuweist den
153674,26,Die Geschwindigkeit endlich womit die Arbeit an der Maschine im
153691,41,Not wendigkeit eine besondre Klasse Arbeiter ausschließlich zu Maschinenar 5
153740,34,alte System der Theilung der Arbeit 10 technisch über den
153801,20,Maschinerie wird mißbraucht um den Arbeiter selbst von Kindesbeinen in
153871,20,vom Bourgeois zu den gröbsten Arbeiten wie Straßenbau u s
153905,28,daß in 25 diesen der Arbeiter auf Kosten des Staats
153911,46,auf Kosten des Staats unproduktive Arbeiten in jenen zum Vortheil
153920,63,Vortheil des Bourgeois produktive städtische Arbeiten und zwar wohlfeiler als
153927,82,zwar wohlfeiler als die regelmäßigen Arbeiter mit denen er so
154078,20,in Bewegung sind Verschiedne minders Arbeiter an der Mule wurden
154170,20,Synthese von Theilarbeiten für die Arbeiter selbst konstruirt Dreizehntes Kapitel
154202,29,und Handwerk bedient sich der Arbeiter des Werkzeugs in der
154233,38,In der Manufaktur bilden die Arbeiter Glieder eines lebendigen Mechanismus
154272,39,wieder durchgemacht wird gleicht der Arbeit des Sisyphus die Last
154278,56,des Sisyphus die Last der Arbeit gleich dem Felsen fällt
154288,73,immer wieder auf den abgematteten Arbeiter zurück 186 Während die
154318,73,Thätigkeit187 Selbst die Erleichtrung der Arbeit wird zum Mittel der
154329,84,indem die Maschine nicht den Arbeiter von der Arbeit befreit
154332,104,nicht den Arbeiter von der Arbeit befreit sondern seine Arbeit
154336,124,der Arbeit befreit sondern seine Arbeit vom Inhalt Aller kapitalistischen
154358,123,es gemeinsam daß nicht der Arbeiter die Arbeitsbedingung sondern umgekehrt
154366,139,sondern umgekehrt die Arbeitsbedingung den Arbeiter anwendet aber erst mit
154393,127,während des Arbeitsprocesses selbst dem Arbeiter als Kapital gegenüber als
154399,144,als Kapital gegenüber als todte Arbeit welche die lebendige Arbeitskraft
154427,130,Mächte des Kapitals über die Arbeit vollendet sich wie bereits
154614,20,heilsamer Erinnrung halten daß ihre Arbeit in der That eine
154623,35,eine sehr niedrige Sorte geschickter Arbeit ist daß keine leichter
154675,28,Geschäft der Produktion als die Arbeit und das Geschick des
154680,46,Arbeit und das Geschick des Arbeiters die eine Erziehung von
154698,59,188 Die technische Unterordnung des Arbeiters unter den gleichförmigen Gang
154734,57,und die schon früher erwähnte Arbeit der Oberaufsicht also zugleich
154742,72,also zugleich die Theilung der Arbeiter in Handarbeiter und Arbeitsaufseher
154775,70,ihre unregelmäßigen Gewohnheiten in der Arbeit verzichten zu machen und
154842,36,es fast unmöglich unter den Arbeitern die das Alter der
154870,44,Kapital seine Autokratie über seine Arbeiter ohne die sonst vom
155173,20,rechtlich und faktisch auf Der Arbeiter muß Morgens um halb
155287,20,sagen doch die Gerichte zum Arbeiter Da ihr unter diesen
155304,34,ihr ihn auch befolgen Diese Arbeiter sind dazu verdammt vom
155353,29,1866 Dort hatte sich ein Arbeiter für 2 Jahre in
155380,39,keinen Umständen mehr für ihn arbeiten zu wollen Wurde wegen
155429,33,gemäß in die Fabrik zurückzukehren Arbeiter erklärt Nein Den Kontraktsbruch
155723,20,Lieblingsoperation der Fabrikanten ist die Arbeiter durch Lohnabzüge für die
155758,24,1866 geben Fälle wo der Arbeiter statt Lohn zu erhalten
155765,42,Lohn zu erhalten durch seine Arbeit und vermittelst des Strafreglements
155883,20,Raub an den Lebensbedingungen des Arbeiters während der Arbeit an
155886,38,Lebensbedingungen des Arbeiters während der Arbeit an Raum Luft Licht
155939,30,beschäftigten Jungen mehr als dreizehnjährigen Arbeiter abzog 15 für das
155987,26,armen Kinder die für ihn arbeiten mit einem Shilling als
156148,20,sacht durch den Eifer der Arbeiter ihr Werk rasch auszuführen
156197,20,Triebkraft sondern an Produktion Die Arbeiter werden daher durch Arbeitsaufseher
156226,31,dies nicht minder wichtig für Arbeiter die nach Gewicht oder
156303,20,eine unbezahlte Operation und die Arbeiter suchen daher so rasch
156411,20,und große Industrie lichkeit des Arbeiters gar nicht zu sprechen191
156429,34,192 438 5 Kampf mischen Arbeiter und Maschine Der Kampf
156592,20,Leben und die Aussichten eines Arbeiters hängen so sehr von
156627,26,Unterstellt Sie brauchen einen zusätzlichen Arbeiter und ihrer zwei meldeten
156740,20,Konstruktion der Fabrikgebäude die den Arbeitern zu gut kommt cf
156859,20,Forster ganz auf Seite der Arbeiter 194 Die Bandmühle ward
156918,20,diese Erfindung möchte eine Masse Arbeiter zu Bettlern machen so
157040,20,sie von 100 000 außer Arbeit gesetzten Menschen in Brand
157057,35,Arkwright s petitionirten 50 000 Arbeiter die bisher vom Wollkratzen
157118,20,Zeit und Erfahrung bevor der Arbeiter die Maschinerie von ihrer
157191,20,wird die Theilung 440 der Arbeit daher vorherrschend als Mittel
157198,37,vorherrschend als Mittel aufgefaßt virtuell Arbeiter zu ersetzen aber nicht
157204,56,zu ersetzen aber nicht wirklich Arbeiter zu verdrängen Dieser Unterschied
157488,20,heißt nur daß viele Millionen Arbeiter erheischt wären um die
157568,20,der vom Mittelalter überlieferten städtischen Arbeiter nicht befriedigt werden und
157598,30,also an der Theilung der Arbeit und der Kooperation in
157614,44,15 hervor daß sie beschäftigte Arbeiter produktiver machen196 Kooperation und
157682,20,Kapital und Lohnarbeit andrerseits soweit Arbeiter durch Arbeitsmittel Schafe Pferde
157708,32,Revolution Erst 25 werden die Arbeiter vom Grund und Boden
157759,25,Arbeitsmittel sofort zum Konkurrenten des Arbeiters selbst197 Die Selbstverwerthung des
158001,20,Produktion beruht darauf daß der Arbeiter seine Arbeitskraft als Waare
158010,34,Waare verkauft Die Theilung der Arbeit vereinseitigt diese Arbeitskraft zum
158041,43,der Tauschwerth der Arbeitskraft Der Arbeiter wird unverkäuflich wie außer
158113,20,großer Trost für die pauperisirten Arbeiter soll sein daß ihre
158532,20,und dem Arbeitsprodukt gegenüber dem Arbeiter giebt entwickelt sich also
158552,29,erstenmal die brutale Revolte des Arbeiters gegen das Arbeitsmittel 10
158562,45,443 Das Arbeitsmittel erschlägt den Arbeiter Dieser direkte Gegensatz erscheint
158722,20,zu Unregelmäßigkeiten aller Art geneigten Arbeiters um einen besondren Mechanismus
158750,30,444 wird das Talent des Arbeiters 30 30 199 The
158826,20,der That sich 35 der Arbeit des Menschen ganz zu
158848,34,für die der erwachsnen männlichen Arbeiter oder roher Arbeiter für
158851,53,erwachsnen männlichen Arbeiter oder roher Arbeiter für geschickte Ure 1
158908,37,ganz und gar von geschickten Arbeitern unabhängig zu machen Ch
