x,y,quote
448713,20,gezeigt daß wenn die Kapitalistenklasse Geld zur Verausgabung von Revenue
448724,36,die Cirkulation hineinwirft sie selbiges Geld auch wieder der Cirkulation
448780,25,entzogen wird sondern zugleich das Geld womit er diese Waaren
448808,36,nichts obgleich er sie mit Geld zahlt Wenn ich mit
448877,20,Der Kapitalist erhält beständig dies Geld zurück als Versilberung von
448925,20,Cirkulation der jährlichen Revenue erforderliche Geld auch hinreichend ist zur
448950,33,zum Werth von 3000 nöthige Geld hinreicht zur Cirkulation des
449487,20,bei seinem Beginn auf einmal Geld in Cirkulation für seinen
449516,23,Es wirft also zunächst mehr Geld in die Cirkulation hinein
449577,20,477 Seite der Cirkulation mehr Geld entzogen als hineingeworfen so
449608,29,von den kapitalistischen Producenten beständig Geld in die Cirkulation geworfen
449677,20,von ihnen in Cirkulation geworfne Geld zur Versilbrung von Waarenwerth
449733,20,Auslage in fixem Kapital mehr Geld aus der Cirkulation herausziehn
449766,28,das als Rohstoff dient nur Geld in die Cirkulation geworfen
449806,32,sich aufhäufenden Schatzes wird als Geld in die Cirkulation geworfen
450020,20,auf Basis bloßer Metallcirkulation das Geld auch als Zahlungsmittel fungiren
450198,20,Ausnahmen allzusammt die Verwandlung in Geld als eine Phase seiner
450209,35,durchlaufen Die Masse des cirkulirenden Geldes muß zu dieser Versilberung
450232,47,Form des Arbeitslohns des 479 Geldes das als Geldform des
450577,20,vollziehenden Ab und Rückströmungen des Geldes bei Umsatz des jährlichen
450656,20,Länge der Produktionsperioden der Waaren Geld vorgeschossen also auch vorher
451489,20,der Procedur besitzen sie 100 Geld sie kaufen für diese
451499,23,100 Arbeitskraft Für diese 100 Geld producirt die gekaufte Arbeit
451527,35,Arbeiter erhalten die Kapitalisten 100 Geld zurück Die Kapitalisten besitzen
451535,51,Kapitalisten besitzen also wieder 100 Geld die Arbeiter aber für
451561,58,nicht abzusehn Wenn die 100 Geld ihnen nicht zurückflössen so
451572,72,sie den Arbeitern erstens 100 Geld für ihre Arbeit zahlen
451621,58,wie die Kapitalisten die 100 Geld besitzen und warum die
451701,20,durch den Rückfluß von 100 Geld der ja nur zeigt
451709,37,nur zeigt warum die 100 Geld nicht verloren gehn Er
451832,20,Arbeiter können nur mit dem Geld zahlen das sie in
451959,20,ihnen hinterher für diese 80 Geld in der That 80
452090,20,nicht Zahlt sie ihnen in Geld 100 und verkauft ihnen
452106,35,so zahlte sie ihnen in Geld 25 mehr als ihren
452329,20,erst dem Arbeiter 100 in Geld zahlen und ihm nachher
452340,34,in Waaren für diese 100 Geld liefern also in der
452454,20,nur das nutzlose Vergnügen 100 Geld vorzuschießen und 80 Waare
452464,36,dafür zu liefern statt 80 Geld vorzuschießen und 80 Waare
452616,20,talisten Sie haben also 100 Geld an diese Gesellschaft zu
452628,35,wollen nun sagen von diesem Geld brauchen diese letztren 80
452668,37,Produkt von ihnen entfernt 80 Geld zurück oder 4 s
452729,20,Produkt von ihnen entfernt 20 Geld zurück oder das letzte
452738,37,letzte Fünftel von den 100 Geld die sie an die
452761,48,den industriellen Kapitalisten die 100 Geld die sie zur Zahlung
452848,20,von den industriellen Kapitalisten in Geld gezahlt in 100 Mit
452871,33,zahlen ihnen also zurück 100 Geld und entziehn ihnen für
452893,44,die müßigen Kapitalisten gezahlten 100 Geld stattgefunden Ist dieser Geldrückfluß
452920,51,Werthsumme von 200 100 in Geld und 100 in Konsumtionsmitteln
452942,58,haben wieder die 100 in Geld aber sie haben verloren
452977,57,statt des Umwegs erst 100 Geld zu zahlen und dann
452984,72,zahlen und dann diese 100 Geld zurückzuerhalten in Zahlung von
453007,77,so strömten ihnen keine 100 Geld aus der Cirkulation zurück
453016,92,zurück weil sie keine 100 Geld in sie hineingeworfen hätten
453460,20,umsonst weggegeben denn die 100 Geld womit sie zum Theil
453469,31,Theil bezahlt waren ihr eignes Geld Ihre eigne Waare ist
453479,48,ihnen also mit ihrem eignen Geld bezahlt worden Also 100
453553,20,die Müßigen unmöglich jährlich 120 Geld zahlen können wenn sie
453561,37,wenn sie jährlich nur 100 Geld einnehmen Also die andre
453577,51,80 Werth für die 100 Geld die sie den Müßigen
453751,20,brillanten Grund 489 weil das Geld womit die Arbeiter gezahlt
454119,20,Mehrwerth darstellt Diesen so in Geld verwandelten Mehrwerth rückverwandelt der
454176,20,seiner verbrauchten fixen Bestandtheile in Geld das aufgeschatzt wird sich
454215,25,Diese 600 cvm werden in Geld verwandelt Von diesem Geld
454219,43,in Geld verwandelt Von diesem Geld werden wieder 400 umge
454314,20,die Verwandlung von Mehrwerth in Geld und die Aufschatzung dieses
454319,38,Geld und die Aufschatzung dieses Geldes für viel längre Zeit
454357,42,Stufenleiter eingetreten denn um das Geld den in Geld aufgeschatzten
454360,60,um das Geld den in Geld aufgeschatzten Mehrwerth in Elemente
454466,20,ihre Produktion wirklich stattfinde Das Geld auf der einen Seite
454486,34,weil deren Möglichkeit ohne das Geld da ist denn Geld
454490,52,das Geld da ist denn Geld an sich selbst ist
454550,34,producirten Mehrwerth selbst successive in Geld speichert dies nach und
454603,24,im successiven Entziehn von cirkulirendem Geld aus der Cirkulation wobei
454615,41,ausgeschlossen ist daß das cirkulirende Geld das er so unter
454661,37,in Konsumtionsmitteln verausgabt würde Aber Geld das dem Umlauf entzogen
454715,26,ebensowenig neuer Reichthum 492 als Geld vom Standpunkt der einfachen
454785,20,Mehrwerth ist neuer Reichthum potentielles Geld geschaffen und nur soweit
454847,20,Vergoldung von Mehrwerth entspringen kann Geld wird der Cirkulation entzogen
454991,20,sich sein von Natur in Geld existirendes Mehrprodukt die Naturalvergoldung
455251,20,durch Vergoldung von Mehrwerth aufgeschatzten Geld Produktionsmittel zuschüssige Elemente von
455324,20,Waaren verkauft gegen 600 in Geld wovon 100 Mehrwerth darstellen
455337,36,Cirkulation entzieht sie aufschatzt als Geld aber diese 100 Geld
455341,55,als Geld aber diese 100 Geld sind 494 nur die
455389,48,des Mehrprodukts von 100 ergatterte Geld der Cirkulation entzieht festhält
455441,36,arbeiten Diese zahlreichen Punkte wo Geld der Cirkulation entzogen wird
455466,45,der Cirkulation weil sie das Geld immobilisiren und es seiner
455704,20,festzuhalten ist dies Obgleich A Geld für seinen Mehrwerth der
455735,27,B etc ihrerseits befähigt werden Geld hinein zu werfen und
455919,20,sein Werth sich allmälig in Geld niederschlägt Wir sahen nun
455987,20,Werththeils desselben der sich in Geld niederschlägt und welchem entspricht
456128,20,und umgekehrt findet Rückfluß des Geldes statt an die Seite
456256,20,die Rolle ein die das Geld nicht nur als Cirkulationsmittel
456421,20,gegenüber mit dem hierdurch gelösten Geld tritt IIC einseitig als
456622,20,Sie haben in keinerlei Art Geld oder Waaren vorzuschießen um
457162,20,sich in wiederholter Entziehung von Geld aus der Cirkulation und
457194,21,veränderte Funktion von bisher umlaufendem Geld Eben fungirte es als
457322,20,2 die Masse dieses in Geld verwandelten Mehrprodukts also des
457803,20,zu dem Cirku lationsproceß nöthige Geld her Soweit die Produkte
457874,20,Hiervon abgesehn wo kommt das Geld her Wir wissen daß
457928,20,ist immer noch wo das Geld herkomme das die B
457973,20,Mehrprodukt umzusetzen Dort kehrte das Geld das nur zur Verausgabung
458001,32,respektiven Waaren hier erscheint dasselbe Geld wieder aber mit veränderter
458019,45,I liefern sich abwechselnd das Geld zur Verwandlung von Mehrprodukt
458339,20,der Cirkulation des Mehrprodukts vorgeschoßne Geld bei normalem Verlauf an
458364,28,Waaren vorgeschossen haben Cirkulirt das Geld als Zahlungsmittel so sind
458852,20,seines I von II gelöste Geld der Cirkulation ent m
459067,20,aber zugleich durch Entziehung des Geldes aus der Cirkulation durch
459795,20,Darstellung des Schema s alles Geld und alle Waaren sich
460868,20,andrer Art ditto Waaren gegen Geld und dasselbige Geld wieder
460871,24,Waaren gegen Geld und dasselbige Geld wieder gegen Waare andrer
461010,20,140 I also mit baarem Geld m kaufen ohne daß
461016,37,m kaufen ohne daß dies Geld zu ihm zurückflösse durch
461135,20,in diesem Kreislauf sich herumtreibende Geld in keiner Weise Dies
461147,35,keine Quelle von Geldakkumulation dies Geld kann dieser Cirkulation auch
461257,20,Geldform des variablen Kapitals fungirenden Geldes freigesetzt und dies könnte
461663,20,Das zu diesem Umsatz nöthige Geld fungirt nur 512 als
461698,22,Bahn zu durchlaufen Entziehung dieses Geldes aus der Cirkulation zur
461760,20,nichts nöthig als daß das Geld von gewissen Seiten her
461775,36,Schatz aufgespeichert wird Daß das Geld gestohlen sein kann und
462025,20,II bilden während die 100 Geld die es dafür zahlt
462053,28,4400 1100 die letztren in Geld 5500 cv II hat
462072,42,Bearbeitung c weitre 50 in Geld für Ankauf neuer Arbeitskraft
462295,20,sind Kapital I 4400 110Ov Geld 5500 Ì c II
462302,35,Ì c II 1600 800 Geld 2400 J cv während
462437,20,Wenn wir hier zunächst vom Geld m absehn so haben
463585,20,er diese inkorporirt wird das Geld Kaufmittel der Waaren II
463615,20,Art wie die Arbeitskraft ihr Geld verausgabt und mit den
464547,20,Kapital Kauft I mit 70 Geld Geldreserve zum Umsatz von
464642,20,der Zeit worin die 70 Geld die von I kamen
464666,32,I zurückgekehrt figurirt 70 in Geld ganz oder theilweis als
464697,40,beiderseitigen Waaren den Rückfluß des Geldes zu seinem Ausgangspunkt bewirkt
464705,56,Ausgangspunkt bewirkt hat Aber das Geld bei normalem Verlauf der
464726,65,wo jedes momentan zusätzlich freigesetzte Geld sofort aktiv als zusätzliches
466178,20,ein andrerseits soweit Akkumulation von Geld seitens des Goldproducenten selbst
466238,20,Goldproduktion stam v m menden Geld geht der Theil des
466342,20,m gekauft und dadurch in Geld verwandelt wird Ist I
466537,20,ihrer Schatz 10 bildung das Geld nicht an seinen Ausgangspunkt
471894,20,konstante zu verwerthen daß er Geld in Arbeitslohn auslegt um
471959,20,Werth zu geben oder das Geld in Maschinerie und Rohmaterial
474973,20,25 Erstens der Werth des Geldes Diesen können wir überall
479458,20,Annahmen c dem Werthausdruck in Geld nach gleich bleiben aber
483381,20,Bank liegt holt er das Geld für Arbeitslohn aus derselben
483388,20,Arbeitslohn aus derselben Kasse das Geld für Roh und Hülfsstoffe
487093,20,oder wenig Arbeit für dasselbe Geld kauft denn so erscheint
487224,20,Kapital besteht repräsentiren nur das Geld des Kapitalisten wie der
487234,36,Leib des römischen Schuldners das Geld seines Gläubigers nach Linguet
497526,20,die Kapitalanlage die Verwandlung von Geld in produktives Kapital erst
497575,20,Markt vorhanden und soll in Geld verwandelt werden ein andrer
497583,37,ein andrer Theil ist als Geld in welcher Form immer
498714,20,arbeitet Es wird mit weniger Geld als früher dasselbe Quantum
499722,20,daß nachdem die Waaren in Geld verwandelt verkauft sind ein
499730,20,sind ein bestimmter Theil dieses Geldes wieder in die stofflichen
499844,20,Kapitals er gezahlt und in Geld ersetzt wird Anders mit
501744,20,so rasch wie möglich in Geld verwandeln wollen Es ist
504754,20,er sein Gewebe für weniger Geld per fi verkauft als
506480,20,dreifach 1 Lokalbehörden zu befähigen Geld mit Einwilligung des Präsidenten
506677,20,Profit Erstens bekamen sie das Geld zur Verbesserung ihrer rauchigen
508974,20,würde bei unverändertem Werth des Geldes wenn es früher 100
509066,20,in Folge einer Werthänderung des Geldes des vorgeschoßnen Kapitals so
515400,20,25 kauft so zieht er Geld zurück im Verhältniß zur
518326,20,ihm producirten Waaren oder in Geld ausgedrückt ihr Preis Werth
520466,20,producirten Waaren mit ihrem in Geld ausgedrückten Werth ganz oder
521030,20,der Gesammtmasse von Waaren und Geld die den Kapitalisten zufallt
521085,20,der Waarenwerthe z B in Geld nur das Resultat ihres
523814,20,spielt Obgleich beide Waare und Geld Einheiten von Tauschwerth und
523861,20,Verkäufer den Gebrauchswerth und das Geld Käufer den Tauschwerth repräsentirt
526790,20,Geldpreisen der Waare oder andren Geld resp Lebensverhältnissen der Käufer
526978,20,sich grade in dieser Summe Geld ausdrückt und in keiner
528399,20,und Tauschwerth von Waare und Geld von Käufer und Verkäufer
528463,20,verwandelt seine Waare in das Geld von B an den
528478,36,er rückver 40 wandelt sein Geld wieder in Waare die
528509,43,vor Ferner Bei Betrachtung des Geldes war angenommen daß die
528552,40,ihrer Geldwerdung und Rückverwandlung aus Geld in Waare durchläuft Sobald
528606,29,Grundlage bleibt wichtig weil das Geld nur aus diesem Fundament
528634,39,Allerdings wird bei Betrachtung des Geldes als Circulationsmittel unterstellt daß
528662,46,kommen wir zum Umlauf des Geldes und zur Entwicklung seiner
528679,57,Zusammenhang für den Uebergang des Geldes in die Funktion als
529403,20,andrer Form sei es des Geldes oder einer andren Waare
551148,20,vorausgesetzten Preisverhältnissen beruhende Funktion des Geldes als Zahlungsmittel unterbricht an
555470,20,der damit 249 gegebnen Leichtigkeit Geld in Kapital zu verwandeln
555779,20,auf dem Markt um in Geld überzugehn ein andrer Theil
555785,34,überzugehn ein andrer Theil in Geld auf dem Markt um
556536,20,so hat er mit dem Geld des Kauf manns den
556555,23,seines Waarenkapitals dessen Verwandlung in Geld vollzogen und kann nun
556565,40,bei sonst gleichbleibenden Umständen das Geld rückverwandeln in Garn Kohle
556600,44,der Leinwand ihre Metamorphose in Geld ihr Verkauf stattgefunden hat
556900,20,das Waarenkapital des Producenten in Geld zu verwandeln die Operationen
556964,20,den Proceß seiner Verwandlung in Geld durchzumachen seine Funktion als
557080,20,die Leinwand verwandelt sie in Geld das Geld des Käufers
557082,38,verwandelt sie in Geld das Geld des Käufers geht in
557093,55,Hand über Mit diesem selben Geld kauft er Garn Kohle
557102,72,Kohle Arbeit etc gibt dasselbe Geld wieder aus um den
557254,20,im Ankauf der Waare vorgeschoßne Geld vom ersten Käufer zurückgezogen
557277,32,vermittelt der zweimalige Stellenwechsel desselben Geldes daß Waare in einer
557307,40,derselben Waare daß das vorgeschoßne Geld wieder aus der Cirkulation
557476,20,beim Kauf der Leinwand das Geld nur als Zahlungsmittel fungirt
557623,20,Agenten seine definitive Verwandlung in Geld also seine erste Metamorphose
557926,20,als G W Rückverwandlung des Gelds in Waare die Produktionsmittel
558291,20,d h seine Verwandlung in Geld zu vermitteln und es
558343,20,diese Funktion verwandelt er sein Geld in Geldkapital stellt sein
558496,20,mit dem so 258 gelösten Geld die nöthigen Produktionsmittel und
558524,30,die Verwandlung seiner Waare in Geld stattgefunden Aber für die
558546,42,ist noch nicht endgültig in Geld rückverwandelt noch nicht als
558945,20,es gehört hierzu außer dem Geld zum Ankauf von Waaren
558951,32,zum Ankauf von Waaren das Geld das ausgelegt werden muß
559012,20,Producenten seine Waare früher in Geld verwandelt wird sondern das
559376,20,verkauft kann er mit demselben Geld das des zweiten kaufen
559460,20,dient verschiedne Waarenkapitale successive in Geld zu verwandeln sie also
559482,33,gegenüber dem Waarenkapital die das Geld über 40 haupt durch
559723,20,hier und verwandelt damit sein Geld in Waare Er ver
559739,33,andren Theil des Waarenkapitals in Geld Auf der einen Seite
559788,28,sich mit der Anwendung des Geldes als Cirkulationsmittel die als
559884,20,sich in der Form des Geldes Daß der Producent der
560035,20,10 Garn vom Garnhändler Das Geld womit der Fabrikant den
560045,36,Garnhändler zahlt ist nicht das Geld des Leinwandhändlers denn dieser
560286,20,je entwickelter die Funktion des Geldes als Zahlungsmittel 35 d
560473,20,hier nur durch Austausch des Geldes gegen Produktionsmittel und Arbeitskraft
560674,20,Producent und Konsument sparen so Geld und Zeit durch die
563537,20,er dessen Produktionspreis G in Geld Sein Verkaufspreis wie früher
563909,20,sei es aus Waare in Geld oder aus Geld in
563912,34,Waare in Geld oder aus Geld in Waare zu verwandeln
564299,20,Verwandlung von Waare Produkt in Geld und 30 von Geld
564303,33,in Geld und 30 von Geld in Waare Produktionsmittel ist
564776,20,verlängerten Aufenthalt seines Produkts in Geld oder Waarenform im Cirkulationsproceß
565092,20,in Cirkulation befindliches Produkt in Geld rückverwandelt ist außerdem noch
565472,20,von dem als Revenue verausgabten Geld und daher auch nur
565950,20,Funktion selbst kraft deren sein Geld Kapital ist läßt der
567500,20,die Verwandlung von Waare in Geld und Geld in Waare
567502,25,von Waare in Geld und Geld in Waare vermittle Es
568021,20,zu verkaufen wie das gelöste Geld wieder in Produktionsmittel zu
568377,20,mit der Wiederverwandlung des realisirten Geldes in Produktionsmittel verbunden sind
569206,20,Der Kaufmann kauft verwandelt sein Geld in Waare verkauft dann
569216,23,verwandelt dieselbe Waare wieder in Geld und so fort in
569257,27,Kaufmannskapitals Preise ducirten Waare gelöste Geld wird benutzt um W2
569278,40,W1 und W2 und dasselbe Geld wechselt so zweimal die
569317,41,vermittelt nur den Rückfluß des Geldes zu ihm Wenn z
569424,20,der Wiederholung der Umläufe des Geldes als bloßes Cirkulationsmittel Wie
569476,20,aber der Beim Umlauf des Geldes als Cirkulationsmittel ist es
569561,20,entzieht der Cirkulation beständig mehr Geld als es hineinwirft Es
569583,33,wo auch die Funktion des Geldes als Zahlungsmittel bei entwikkeltem
573873,20,rein technischen Bewegungen die das Geld durchmacht im Cirkulationsproceß des
574246,20,ein Theil desselben sich in Geld verwandelt um sich später
574264,30,in Waare um sich in Geld rückzuver 25 wandeln Ob
574270,48,rückzuver 25 wandeln Ob das Geld hier als Cirkulationsmittel oder
574295,56,Kapitalist beständig an viele Personen Geld auszuzahlen und beständig von
574302,73,und beständig von vielen Personen Geld in Zahlung zu empfangen
574313,88,bloß 30 technische Operation des Geld Zahlens und des Geld
574317,108,des Geld Zahlens und des Geld Einkassirens bildet Arbeit für
574326,125,für sich die soweit das Geld als Zahlungsmittel fungirt Bilanzberechnungen
574455,20,Rückbildung aus im Verkauf erhaltnem Geld und fällig gewordner Zahlung
574465,36,diese beständige Bewegung des als Geld existirenden Theils des Kapitals
574609,20,Kassirer weitgetriebne Arbeitstheilung Auszahlung des Geldes Einkassirung Ausgleichung der Bilanzen
574619,36,Führung laufender Rechnungen Aufbewahren des Geldes etc getrennt von den
574659,38,aus den verschiednen Bestimmtheiten des Geldes selbst und aus seinen
574863,20,Handels der die Funktionen des Geldes als Weltgeldes vermittelt Diese
575348,20,aus den doppelten Funktionen des Geldes als Landesmünze und als
575374,25,sich Erstens die Ansammlung des Geldes als Schatz d h
575500,20,ist damit verbunden Ausgeben des Geldes beim Kaufen 25 Einnehmen
575596,20,anwenden einen gewissen Betrag in Geld wofür er ihnen ein
575794,20,nur Resultate Bei Betrachtung des Geldes wie sich seine Bewegungen
575824,28,als Kaufmittel und Zahlungsmittel cirkulirenden Geldes bestimmt ist durch die
575946,20,Waarenaustausch wie die Bewegung des Geldes als inländisches Kauf und
576417,20,Ausgleichung der Bilanzen soweit das Geld als Zahlungsmittel fungirt und
576486,20,Ausgleichung dieser Resultate Soweit das Geld 35 als Kaufmittel cirkulirt
576523,26,zu ihrem Umschlag nöthigen baaren Geldes vermindern Der Geldhandel in
576569,25,daraus entspringenden verschiednen Funktionen des Geldes Dies unterscheidet den Geldhandel
576625,20,Stelle wechselt und dadurch das Geld zurückfließt im Gegensatz zu
576635,37,W G W wo das Geld zweimal die Hände wech
577238,20,industrielles Kapital und das Cirkulationskapital Geld und Waarenkapital thatsächlich nur
577722,20,sie gegeben sind für das Geld und für die Bewegung
577728,31,und für die Bewegung des Geldes Das einzig Nöthige ist
577908,20,aus Verwandlung der Waare in Geld Verkaufen und 310 Verwandlung
577914,36,Verkaufen und 310 Verwandlung des Geldes in Waare Kaufen Und
578049,20,immer als Geldvermögen und sein Geld fungirt stets als Kapital
578061,36,ist stets G W G Geld die selbständige Form des
578795,20,Im Cirkulationsproceß entwickelt sich das Geld zu Kapital In der
578811,24,als Tauschwerth als Waare und Geld Das Kapital kann sich
578839,35,zwischen denen die Cirkulation vermittelt Geld und Waarencirkulation können Produktionssphären
579409,20,Waaren alle Werth und darum Geld sind der Qualität nach
579539,20,der Waarencirkulation W G W Geld nicht nur als Werthmaß
579565,31,sein Beisichbleiben und Anwachsen als Geld zum Selbstzweck wird so
579582,45,Kaufmannskapitals G W G das Geld der Schatz hervor als
580006,20,und kosmopolisirt sie entwickelt das Geld zum Weltgeld Der Handel
582644,20,Größe denselben jährlichen Durchschnittsprofit ab Geld hier genommen als selbständiger
582656,20,Werthsumme ob sie thatsächlich in Geld oder Waaren existiré kann
582722,20,dem Gebrauchswerth den es als Geld besitzt einen zusätzlichen Gebrauchswerth
583168,20,1 Daß ein Mann der Geld borgt mit der Absicht
583268,20,als Kapital verausgabt werden das Geld also ausgelegt wird im
583441,20,abgetreten Der Ausgangspunkt ist das Geld das A dem B
583505,20,Hand von B wird das Geld wirklich in Kapital verwandelt
583583,20,ist 1 die Verausgabung des Geldes als Kapital 2 sein
583665,20,W findet zweimaliger Stellenwechsel desselben Geldes statt zeigt aber die
583678,36,Waare an die erst in Geld und dann aus Geld
583682,55,in Geld und dann aus Geld wieder in eine andre
583770,20,pflegt Dieser doppelten Verausgabung des Geldes als Kapital wovon die
583903,20,abzugeben da dieser ihm das Geld nur gegeben hat als
584018,20,als Waare auftritt oder daß Geld als Kapital zur Waare
584129,20,realisiren seine verwandelte Gestalt als Geld annehmen Es ist deßwegen
584279,20,der That nur einfach als Geld d h als Kaufmittel
584290,35,Waare den Produktionselementen Daß dies Geld 20 hier zugleich Geldkapital
584316,46,Funktion die es hier als Geld verrichtet sondern aus dem
584336,55,dieser Akt den es als Geld verrichtet den kapitalistischen Produktionsproceß
584363,60,als Waare Geldkapital nur als Geld In keinem einzelnen Moment
584393,61,vorstellt oder veräußert er das Geld als Kapital an den
584412,68,einfach als Waare und das Geld einfach als Geld als
584415,87,und das Geld einfach als Geld als Kaufmittel von Waare
584505,20,nun in der Form des Geldes oder der Waare oder
584604,20,verkauft oder ihm als einfaches Geld für Waare hingegeben Es
584621,35,sondern nur als Waare oder Geld und dies ist hier
584633,50,Dasein für andre Waare und Geld sind hier nur Kapital
584644,65,soweit die Waare sich in Geld das Geld sich in
584646,85,Waare sich in Geld das Geld sich in Waare verwandelt
584720,40,Charakter Der Geldbesitzer der sein Geld als zinstragendes Kapital verwerthen
584884,20,oder cirkulirendes Kapital verliehen Das Geld kann in beiden Formen
584998,20,das was ausgeliehen wird weder Geld noch cirkulirendes Kapital so
585186,20,immer nur als Waare oder Geld und seine Bewegung löst
585222,25,Reproduktionsprocesses betrachten Gehn wir vom Geld aus und es ist
585248,37,also selbst sub specie des Geldes betrachten so ist eine
585292,34,Kreisbewegung Nun wird aber das Geld soweit es als Kapital
585329,38,kann Es wird weder als Geld noch als Waare ausgegeben
585342,52,gegen Waare wenn es als Geld vorgeschossen wird noch 336
585353,67,Kapitel Zinstragendes Kapital verkauft gegen Geld wenn es als Waare
585392,62,und worin das Kapital als Geld heckendes Geld auftritt wird
585394,81,das Kapital als Geld heckendes Geld auftritt wird hier ohne
585498,20,vend p 9 Der Gegenstand Geld Haus etc wechselt nicht
585518,34,nicht daß beim Weggeben des Geldes in Form von zinstragendem
585576,20,der in der Form von Geld oder was hier nur
585595,35,wird Beim Kauf wird das Geld weggegeben aber nicht sein
586122,20,Preis Ge 56 Ein Haus Geld etc sollen daher wenn
586355,20,ein Dieser erste Stellenwechsel des Geldes drückt keinen Akt der
586382,29,empfangen wird Die Rückkehr des Geldes aus der Hand des
586710,20,der nur bedingungsweisen Veräußerung von Geld oder Waare Die charakteristische
586722,32,Kapitals überhaupt die Rückkehr des Geldes zum Kapitalisten die Rückkehr
586754,40,getrennte Gestalt A gibt sein Geld weg nicht als Geld
586758,58,sein Geld weg nicht als Geld sondern als Kapital Es
586847,20,A zurück Weggeben Verleihen von Geld für eine gewisse 20
586877,30,Die wirkliche Bewegung des ausgeliehenen Geldes als Kapital ist eine
587002,20,als ob die Form des Geldes dem ausgeliehenen Kapital nie
587074,20,Die bloße Form des Kapitals Geld das als Summe A
587125,20,des Cirkulationsprocesses Erst wird das Geld in Produktionsmittel verwandelt der
587144,35,Waare wird es rückverwandelt in Geld und kehrt in dieser
587201,22,ist ausgelöscht Aber weil das Geld als Kapital vorgeschossen die
587298,20,selbst zurückfließt Die Verleihung von Geld als Kapital seine Weggabe
587316,34,also zur Voraussetzung daß das Geld wirklich als Kapital verwandt
587331,49,Ausgangspunkt Die wirkliche Kreislaufbewegung des Geldes als Kapital ist also
587344,62,Transaktion wonach der Anleiher das Geld an den Verleiher zurückzugeben
587354,78,hat Legt der Anleiher das Geld nicht als Kapital aus
587404,61,G worin die Werthsumme als Geld oder als Waare fungirt
587430,62,G durch Sie wird als Geld oder Werthsumme in irgend
587447,70,zurück Der Ver leiher des Geldes verausgabt es nicht im
587474,71,verkauft er sie nicht gegen Geld sondern schießt sie vor
587519,59,Kapital zu veräußern statt als Geld oder Waare Woraus 5
587572,42,untersuchen Der Verleiher gibt sein Geld als Kapital aus die
587745,20,Veräußerung macht das Verleihen des Geldes zur Veräußerung des Geldes
