x,y,quote
406155,33,aufgehoben durch die Form dieses Geldes selbst ob es Metallgeld
408669,20,Das für ihren Arbeitslohn erhaltne Geld bildet für sie Revenue
408905,20,h das als Arbeitslohn erhaltne Geld in den Konsumtionsstock der
408954,20,dem Preis seiner Arbeit dem Geld worin sein Arbeitslohn ausgezahlt
408963,37,ausgezahlt wird er realisirt dies Geld indem er damit Konsumtionsmittel
409058,20,woraus dies letztre Kapital besteht Geld Lebensmittel Rohstoffe und fertige
413499,20,Sinn daß der Kapitalist in Geld den dem Arbeiter zufallenden
413530,20,oder ob er ihn mit Geld zahlt das er bereits
413549,35,ob er durch Kredit dies Geld anticipirt hat in allen
413563,49,Kapitalist variables Kapital das als Geld den Arbeitern zufließt und
413624,29,ihm der Kapitalist selben in Geld aus Für den Kapitalisten
413835,20,Arbeitskraft an den Kapitalisten das Geld womit der Kapitalist sie
413847,34,für ihn zur Verwerthung angelegtes Geld also Geldkapital es ist
413873,45,davon wo der Kapitalist das Geld selbst hernimmt Vorgeschossen ist
413929,30,Werth realisirt dessen Preis in Geld der Käufer gibt sein
413934,48,Geld der Käufer gibt sein Geld weg und erhält dafür
414127,20,dem für seine Waare gelösten Geld und was in der
414174,20,als Kaufpreis der Arbeitskraft gelöste Geld für den Arbeiter Revenue
414308,20,für sie die Arbeiter Das Geld womit der Kapitalist die
414440,20,sie gekauft hat Aber das Geld was der Arbeiter vom
414485,20,Es ist also nicht das Geld das zweimal fungirt erst
414515,30,beim Verkauf der Arbeitskraft das Geld wirkt bei Stipulirung des
414601,20,das ist nicht Alles Das Geld das der Arbeiter erhält
416769,20,erst durch den Verkauf in Geld zu verwandeln um weiter
416795,20,das Waarenprodukt bevor es in Geld verwandelt wird Es gehört
416942,20,ist muß dieser nun in Geld existirende Werth wieder verwandelt
417068,20,der zahlt ihm denselben in Geld Daß dieser Theil des
417590,20,Waarenwerths qua Waarenwerth oder des Geldes qua Geld ändert daß
417592,35,Waarenwerth oder des Geldes qua Geld ändert daß sie als
418848,20,Verkauf seines Waarenprodukts erst in Geld umsetzen und dann durch
420827,20,in Zahlung der Arbeitskraft verausgabte Geld ist der den variablen
420860,20,die Rückverwandlung der Waare in Geld ihr Verkauf die dem
420952,20,des konstanten Kapitals II in Geld die Kapitalisten II ihrerseits
420992,24,von Produktionsmitteln bestand wieder in Geld verwandelt und kann jetzt
421043,20,ihres Waarenkapitals Was aber das Geld betrifft das nöthig ist
421096,20,aber unter allen Umständen das Geld von diesen Kapitalisten herrühren
421222,20,unsern Zweck die Hälfte des Geldes werde von den Kapitalisten
421678,20,eines Mehrwerththeils seines Waarenprodukts vorgeschoßne Geld zurückströmt so nur weil
421707,24,existirenden Mehrwerth noch je 500 Geld in Cirkulation geworfen Sie
421725,39,Austausch ihrer resp Waarenäquivalente Das Geld das sie über die
421781,26,Form von Konsumtionsmitteln 500 in Geld es besitzt jetzt 2000
421791,43,in Produktionsmitteln und 500 in Geld wie vorher ebenso I
421812,54,verwandelt in Konsumtionsfonds 500 in Geld wie vorher Es folgt
421820,70,Es folgt allgemein Von dem Geld das die industriellen Kapitalisten
421934,20,bezahlt der gleich diesem in Geld ausgelegten variablen Kapital Dafür
421980,20,der Zahlung der Arbeitskraft in Geld vorgeschoßne variable Kapital kehrt
422035,20,und erst indem diese das Geld zum Ankauf von Produktionsmitteln
422637,20,das von den Arbeitern ausgegebne Geld Anders verhält es sich
422815,20,ihre Arbeitskraft 100 erhalten in Geld sage 100 sie kaufen
423094,20,Abtheilung Diesen kehrt damit 400 Geld zurück ihr selbigen Arbeitern
423170,20,von a kaufen mit diesem Geld zum selben Werthbelauf Luxusartikel
423794,20,vorgeschoßnes variables Kapital wieder in Geld ersetzt andrerseits was die
425063,20,in Waaren ausgedrückte Werth des Geldes fällt ohne wirkliche sonstige
425769,20,IIa erhalten damit das nöthige Geld um die oben angenommenen
425885,20,den Waarenproducenten die der Cirkulation Geld vorschießen selbes zurückkehrt bei
425927,22,vorschießt der eigentliche Rückflußpunkt dieses Geldes die Tasche dieses Geldkapitalisten
425938,39,In dieser Weise obgleich das Geld durch alle Hände mehr
425951,53,gehört die Masse des cirkulirenden Geldes der in Form von
426007,38,in Cirkulation geworfen werden und Geld das in Cirkulation geworfen
426029,48,oder Händewechsel der Gebrauchswerthe Das Geld verschwindet nicht weil es
426078,39,für diese Cirkulation 500 in Geld von II vorgeschossen werden
426114,42,zuerst als Käufer auftreten also Geld in Cirkulation werfen Es
426160,36,II Konsumtionsmittel für 500 das Geld fließt also zurück zu
426180,48,Es warf erst für 500 Geld in Cirkulation und zog
426203,56,und zieht zum selben Werthbetrag Geld aus ihr heraus so
426223,63,in Cirkulation geworfen für 500 Geld und für 500 Waaren
426241,72,500 Waaren und für 500 Geld Die Cirkulation braucht für
426258,80,500 Waaren II nur 500 Geld wer das Geld also
426261,99,nur 500 Geld wer das Geld also vorgeschossen beim Kauf
426310,76,kehrt das in Arbeitslohn angelegte Geld d h das in
426383,30,II zahlt die Arbeitskraft in Geld er verleibt dadurch die
426453,20,diesem das in Arbeitslohn ausgelegte Geld zurück Soweit der Verkauf
426469,35,sondern Aequivalente in Waare und Geld ausgetauscht werden ist derselbe
426490,47,Arbeiter nicht zweimal erst in Geld und dann in Waare
426496,65,und dann in Waare sein Geld kehrt zu ihm zurück
426521,69,also das in Arbeitslohn vorgeschoßne Geld spielt aber eine Hauptrolle
426562,60,Gesellschaft gleichzeitig variables Kapital in Geld vorgeschossen werden muß in
426634,22,um so mehr da dasselbe Geld vor seinem Rückfluß zum
426707,20,und diese wieder für dasselbe Geld Produktionsmittel von den Kapitalisten
426747,24,Kapitalisten II schießen weitere 500 Geld vor um Produktionsmittel bei
426760,40,die Kapitalisten I verausgaben das Geld in Konsumtionsmitteln von II
426795,45,in seine produktive Naturalform Dies Geld strömt wieder zu I
426828,48,vorhin im Besitz von 500 Geld und 2000 konstantem Kapital
426849,56,umgesetzt worden ist Mit 1500 Geld ist eine Waarenmasse von
426885,55,3 II kauft mit demselben Geld Produktionsmittel von I dem
426971,20,folgt 1 I zahlt 1000 Geld für Arbeitskraft also für
427018,20,Waare 1000 Damit sind 1000 Geld als Geldform des variablen
427170,20,d h es hat das Geld verausgabt das es für
427389,20,verkauft wird verwandelt sich das Geld II in einen Theil
427407,33,W G durchmacht sich in Geld verwandelt das aber keinen
427482,20,der also dies W in Geld umsetzt konstanten Kapitalbestandtheil variablen
427515,28,angeht so zieht sie mehr Geld aus der Cirkulation heraus
427583,20,successive 1 variables Kapital in Geld rückverwandelt 1000 2 die
427654,20,II 414 dadurch daß dies Geld in Konsumtionsmitteln vermöbelt wird
427667,36,I haben nur soviel in Geld entzogen als sie an
427741,20,Verwandlung der Waare I in Geld und der darauf folgenden
427748,37,der darauf folgenden Verwandlung des Geldes I in Waare II
427771,49,Anzahl der Umläufe des cirkulirenden Geldes rascher so wäre noch
427777,66,rascher so wäre noch weniger Geld hinreichend um die umgesetzten
427841,40,Es würden also 250 in Geld hinreichen für die Cirkulation
427930,20,als Käufer auftritt also 500 Geld in Konsumtionsmitteln von selbem
427990,20,selbst in ihrer Privatkonsumtion verausgabtes Geld das anticipirte Revenue vorstellt
428038,20,Umsetzung No 4 500 in Geld in die Cirkulation geworfen
428056,35,Erlös verkaufter Waare Fließt dies Geld an I zurück so
428067,51,I damit nur sein zuschüssiges Geld zurück erhalten nicht seinen
428106,50,durch Verkauf der Waare eingelöste Geld nicht von neuem in
428118,62,ist I kauft mit zuschüssigem Geld 500 von II Konsumtionsmittel
428124,81,500 von II Konsumtionsmittel dies Geld ist verausgabt von I
428137,94,Aequivalent in Waare II das Geld fließt zum ersten Mal
428184,73,ihm selbst in Cirkulation geworfne Geld seinen eignen Mehrwerth ebenso
428239,49,I Produktionsmitteln und 500 in Geld es hätte dagegen noch
428258,58,und wäre dagegen 500 in Geld losgeworden Dahingegen hätte II
428291,58,in der That von brachliegendem Geld oder seine Funktion unterbrechendem
428298,74,seine Funktion unterbrechendem und abwartendem Geld Dauerte diese Situation länger
428347,59,der Stelle der vorgeschoßnen 500 Geld da die I besaß
428360,69,von 1000 in Waarenform Als Geld befinden sie sich in
428427,36,uns zugleich Repräsentanten aller andern Geld aus in Konsumtionsmitteln so
428539,20,daß der Kapitalist selbst das Geld in die Cirkulation warf
428573,27,um einen Betrag in klingendem Geld gleich dem oder gleicher
428626,20,Kapitalist aus der Geschäftseinnahme selbst Geld für seinen persönlichen Konsum
428658,29,ist hier ganz gleichgültiger Umstand Geld auf erst zu ergatternden
428795,20,auf künftigen Mehrwerth hin verausgabten Geldes klar hervor Macht unser
428842,20,der Satz daß sie das Geld zur Realisation ihres Mehrwerths
428898,20,der gesellschaftlichen Produktionsmittel wie des Geldes ist Das Paradoxe läge
428920,34,den Waaren steckenden Mehrwerths nothwendige Geld aus eignen Mitteln vorschösse
428942,45,daß er als Käufer agirt Geld verausgabt im Ankauf von
428949,62,im Ankauf von Konsumtionsmitteln oder Geld vorschießt im Ankauf von
428969,70,von Produktionsmitteln Er gibt das Geld immer nur weg gegen
428981,83,Er schießt der Cirkulation nur Geld vor in derselben Art
429015,76,Handelskapitals dessen erste Form immer Geld da der Kaufmann als
429114,20,pro parte werfen auch sie Geld in die Dritter Abschnitt
429274,20,Waarenprodukt er verwandelt es in Geld Indem er es in
429279,37,Geld Indem er es in Geld verwandelt hat er auch
429290,53,konstanten Werththeil seines Produkts in Geld rückverwandelt Mit diesem in
429295,72,Geld rückverwandelt Mit diesem in Geld verwandelten Werththeil kauft er
435416,20,im kapitalistischen Proceß fungirt Das Geld das zuerst als Geldform
435487,20,die einfache Thatsache daß das Geld des Käufers hier des
435533,20,Arbeiter sondern es ist dasselbe Geld das erst in der
435575,23,Arbeitskraft dient Daß aber dasselbe Geld 4381 in der Hand
435624,20,A G W Umsatz von Geld in Arbeitskraft auf Seite
435641,36,Umsatz der Waare Arbeitskraft in Geld auf Seite des Verkäufers
435664,47,zu bekümmern Sie sagen dasselbe Geld realisirt hier zwei Kapitale
435695,51,seine Waare die Arbeitskraft in Geld um das er als
435991,20,er erhält diesen Werth in Geld ausgezahlt in der Form
436000,33,Form des Arbeitslohns Mit diesem Geld kauft er von II
436276,20,konstanten Kapitalwerths IIC sondern das Geld das für I als
436319,20,440 mittel von Konsumtionsmitteln Das Geld 1000 das den Kapitalisten
436374,20,den Käufern seiner Waare gelösten Geld für 1000 Produktionsmittel von
436417,22,Konsumtionsmittel zum Werth von 1000 Geld 1000 Produktionsmittel zum Werth
436481,20,I hat ursprünglich mit 1000 Geld bestimmt als variables Kapital
436507,32,Geldform weggegebnen 1000 erhalten das Geld gehört jetzt v dem
436523,45,von II I kann dies Geld das so in die
436599,20,nach ein Aequivalent des in Geld vorgeschoßnen variablen Kapitaltheils So
436639,24,diese im Produktionsproceß fungirt Als Geld war der variable Kapitalwerth
436703,20,Die Cirkulationsbewegung ist hier 1000 Geld Arbeitskraft zum Werth von
436718,36,Aequivalent des variablen Kapitals 1000 Geld also v G W
436955,20,dem für seine Arbeitskraft gelösten Geld als Käufer eines Theils
436985,28,im Ankauf seiner Arbeitskraft gezahlte Geld ersetzt durch einen Theil
437026,30,den Werth seiner Arbeitskraft in Geld reali 1 442 sirt
437034,47,442 sirt und realisirt dies Geld jetzt wieder indem er
437066,52,der Revenue des Arbeiters in Geld gegen den von ihm
437083,61,Kapitalisten So kehrt dies v Geld zum Kapitalisten II als
437112,63,nicht dadurch daß er das Geld das er dem Arbeiter
437273,20,den Rückfluß der 500 in Geld entwickelt Destutt de Tracy
437317,20,Waare besaß wieder zurück in Geld in der Form worin
437351,28,der dadurch vermittelte Rückfluß des Geldes zu seinem Ausgangspunkt ist
437364,44,Kapitalist II für 500 in Geld Waare von Kapitalist I
437387,54,wären ihm ebenfalls 500 in Geld zurückgeströmt Die 500 Geld
437391,72,in Geld zurückgeströmt Die 500 Geld hätten nur zum Umsatz
437416,75,an den zurückgeflossen der das Geld zum Umsatz dieser Waarenmasse
437427,87,Cirkulation geworfen Aber die 500 Geld die zu Kapitalist II
437443,96,Kapital in Geldform Warum dies Geld also auch Geldkapital ist
437463,99,Arbeitskraft Die Rückkehr der 500 Geld zu Kapitalist II ist
437490,92,auch die Wiedererscheinung der 500 Geld nicht nur als Geld
437494,111,500 Geld nicht nur als Geld sondern auch als variables
437510,120,eine und dieselbe Procedur Das Geld 500 fließt an Kapitalist
437570,77,Die Rückkehr der 500 in Geld zum Kapitalisten II ist
437586,81,Arbeitskraft als durch die 500 Geld kaufbare Waare und damit
437594,98,und damit Rückkehr der 500 Geld als potentielles variables Kapital
437630,86,wie mit I v Das Geld das den Kapitalisten IIb
437690,54,vermittelst deren den erstren das Geld nur auf einem Umweg
437786,20,Rückfluß der 1000 IIC in Geld zu I also auch
437818,29,hat wie überhaupt Reservekapital in Geld nöthig ist um ununterbrochen
437835,43,20 des variablen Kapitalwerths in Geld fortarbeiten zu können Hat
438063,20,dieser Arbeitskraft vom Kapitalisten vorgeschoßne Geld zu diesem zurückkehrt kehrt
438093,28,v halten wir 1000y in Geld auf Seiten der Kapitalisten
438211,20,erste Form 1000 I in Geld das in Arbeitskraft zum
438243,28,die Arbeiterklasse I mit 1000 Geld dem Waarenverkäufer II gegenübertritt
438255,44,die Arbeiterklasse II mit 500 Geld dem Waarenverkäufer von 500
438336,20,vmv sprünglichen Werths 1000 in Geld ist ein doppelt so
438383,20,exaktes Aequivalent des in 1000 Geld von I ursprünglich v
438403,35,sind sie aber nur potentiell Geld werden es wirklich erst
438445,35,als Material worin sich 1000 Geld umsetzen kann v Dritter
438496,28,Waarenwerth 4 endlich wieder in Geld dem die Arbeitskraft worin
438611,20,sich vielmehr v um in Geld durch seinen Verkauf an
438641,29,Kapital I 1000 in v Geld dies Geld hat aufgehört
438643,49,1000 in v Geld dies Geld hat aufgehört als Geldform
438662,61,Arbeitskraft umgesetzt ist wie das Geld jedes andern Waarenverkäufers aufgehört
438689,64,die das als Arbeitslohn bezogne Geld in der Hand der
438705,73,variablen Kapitals sondern des in Geld verwandelten Werths ihrer Arbeitskraft
438762,50,daß das dem Arbeiter ausgezahlte Geld immer noch sein des
438768,67,immer noch sein des Kapitalisten Geld ist Ist der Kapitalist
438896,20,es ist der Arbeitslohn das Geld des Arbeiters das gerade
439302,20,wird dies Werthelement versilbert in Geld verwandelt wie die andren
439311,32,andren nach seiner Verwandlung in Geld aber erscheint sein Unterschied
439366,22,Das aus der Waare gelöste Geld muß also beständig in
439429,20,das aus dem Waarenverkauf eingehende Geld soweit es für diesen
439591,20,das aus dem Waarenverkauf gelöste Geld soweit es den Waarenwerththeil
439688,20,neben ihm vollständig ersetzt in Geld der Summe der Geldniederschläge
439721,28,Waaren in Geldform übergegangen Dies Geld dient dann dazu das
439754,36,Kapitals wirklich zu erneuern Dies Geld ist also Geldform eines
439819,20,natura ersetzt werden muß Dies Geld verliert aber nur seine
439886,20,seiner verschiednen Bestandtheile auflösen Das Geld spielt eine specifische Rolle
440458,20,natura zu ersetzen sondern in Geld zu verwandeln das als
440662,20,Werth von 2000 IIC in Geld zu ersetzen ist daher
440698,25,das zu diesem Umsatz nöthige Geld sich aufgehäuft in den
440908,20,fixen Kapitals sich zunächst in Geld niederschlagen muß das innerhalb
440927,33,wieder als Cirkulationsmittel fungirt Das Geld aber wodurch das Verschleißelement
440941,47,Waarenwerth 2000 IIC steckt dies Geld kann nur von I
441003,26,Gesetz kehrt der Cirkulation vorgeschoßnes Geld an den kapitalistischen Producenten
441096,20,das während dieses Umsatzes cirkulirende Geld kehrt zurück zu I
441161,20,der laufenden jährlichen Reproduktionsperiode aus Geld wieder rückverwandelt in die
441182,34,nur dann eine Bilanz in Geld zufließen wenn II zwar
441214,41,zu machen durch 200 in Geld das nicht zu ihm
441226,55,es dies der Cirkulation vorgeschoßne Geld ihr nicht wieder entzogen
441374,20,200 für Verschleißersatz der in Geld aufzuschatzen so zerfiele der
441395,33,in 200 Verschleißersatz die in Geld nach dem Verkauf der
441576,20,in Cirkula vm tion in Geld 1000 in Arbeitslohn und
441593,33,Umsatz hat I 1000 in Geld 800 umgesetzt in 800
441604,49,vm Konsumtionsmittel und 400 in Geld II wirft in Cirkulation
441617,63,Konsumtionsmittel und 400 c in Geld nach vollendetem Umsatz hat
441631,75,I Produktionsmittel und 400 in Geld Wir haben jetzt noch
441870,20,sehen Producenten durch Verkauf in Geld realisiren müssen in der
441900,28,in der Hand von 20 Geld Verleihern Ist aber der
442041,20,beigezogen wird und mit seinem Geld über alle Schwierigkeiten weghilft
442203,20,kapitalistischen Producenten der Cirkulation vorgeschoßne Geld zu seinem Ausgangspunkt zurückkehren
442214,35,wobei es gleichgültig ob das Geld ihnen gehört oder gepumpt
442238,46,werde durch von I vorgeschoßnes Geld 2 Ersatz des fixen
442264,53,dem Ersatz des Verschleißtheils in Geld auch noch die Vollziehung
442317,40,von I vorgeschossen werden in Geld ist nur Konstatirung von
442327,55,Thatsache Der Arbeitslohn ist in Geld auszuzahlen von den respektiven
442335,73,den respektiven kapitalistischen Producenten dies Geld wird dann von den
442437,20,einmal I weitere 400 in Geld vorschießt zum Ankauf von
442493,20,gesellschaftlichen Gesamtkapitals zum Waarenumsatz nöthige Geld der Cirkulation vorschießt Da
442514,34,abgeschmackt verwerflich wonach I zuschüssiges Geld in die Cirkulation würfe
442539,44,übrig daß II selbst das Geld in die Cirkulation wirft
442597,27,auf der andren Seite als Geld bei ihm aufsammeln X
442617,41,so der Cirkulation 200 in Geld vorschießen Y kauft von
442688,20,200 noch andre 200 in Geld jährlich aus seiner Tasche
442795,20,daß sein Werth successiv in Geld angesammelt wird Der erstre
442916,20,Produktionsmittel sondern auch durch ihr Geld ihr fixes Kapital in
442933,34,der Kapitalisten II mit ihrem Geld nur den cirkulirenden Theil
443025,20,gedeckten Theil von Produktionsmitteln 200 Geld umgesetzt in neue fixe
443036,36,in natura Sein so verausgabtes Geld wie beim Anfang des
443085,32,dieser zahlt ihn mit dem Geld womit der erste Theil
443160,20,an daß II 400 in Geld vorschießt zum Umsatz dieser
443189,31,von IIC der 200 in Geld als Verschleißwerth aufgehäuft und
443291,20,sich durch den Umsatz in Geld niederzuschlagen hat Der erste
443364,20,realisirt haben bleibt aber 200 Geld so noch für ihn
443494,20,seiner Hand unter Geldform Dies Geld ist aber versilberter Mehrwerth
443521,31,Waarenwerth von II 400 Das Geld fließt also zu II
443675,20,Fall hat von den 400 Geld die I jetzt zurückschickt
443694,33,ausgelegt 300 nämlich 200 in Geld wofür es fixe Kapitalelemente
443707,48,I gezogen und 100 in Geld zur Vermittlung seines Waarenaustauschs
443735,55,mit I Von den 400 Geld hat Theil 1 also
443764,57,3 des von ihm vorgeschoßnen Geldes Er 2h besitzt aber
443789,61,Werth von 200 hat er Geld an I gegeben aber
443815,64,nachträglich wieder als Verkäufer Dies Geld kann daher nicht an
443843,65,Drittel des von ihm vorgeschoßnen Geldes trat Theil 1 erst
443859,73,seines konstanten Kapitals Mit demselben Geld kauft I von ihm
443873,84,zum Werth von 100 Das Geld fließt also zu ihm
443916,71,von 100 erst 100 in Geld und dann noch obendrein
443938,72,Theil 2 der 100 in Geld ausgelegt 300 in Geld
443942,91,in Geld ausgelegt 300 in Geld zurück 100 weil er
443951,109,er erst als Käufer 100 Geld in Cirkulation warf und
443978,103,nicht aber als Käufer Das Geld kann also nicht an
444005,95,fixen Kapitalelementen in Cirkulation geworfne Geld aber es kommt in
444018,105,Theil 2 nicht als das Geld des Theil 1 sondern
444028,120,als der Klasse I gehörendes Geld b Unter dieser Voraussetzung
444045,126,daß Theil 1 200 in Geld und Theil 2 400
444063,129,alle verkauft aber 200 in Geld sind verwandelte Form des
444092,114,auf und erhält statt seines Geldes Waare I in Naturalelementen
444117,105,zwischen I und II kein Geld von I vorgeschossen wird
444192,48,Theil 1 besitzt 200 in Geld und 200 in Waare
444212,56,unter dieser Voraussetzung nichts in Geld vorzuschießen weil er I
444250,55,Theil 1 schießt 400 in Geld vor 200 zum gegenseitigen
444268,62,I Mit diesen letzteren 200 Geld kauft er die fixen
444279,76,462 I kauft mit 200 Geld für 200 Waare von
444294,87,für diesen Waarenumsatz vorgeschoßnen 200 Geld zurückfließen und I kauft
444322,83,damit sein fixer Kapitalverschleiß in Geld niederschlägt Die Sache würde
444346,82,1 Klasse I die 200 Geld zum Umsatz der existirenden
444401,56,1 hat dann für 200 Geld um zu kaufen und
444419,63,400 einzutauschen von I 200 Geld kehren dann zu I
444467,52,Theil 1 II hat 200 Geld als bloßer Käufer von
444504,50,I das für Waarenumsatz ausgelegte Geld 200 zurückgeflossen nicht via
444541,49,Waare von ihm vorgeschoßnen 200 Geld sind ihm ditto zurückgekehrt
444580,47,400 m II 1 200 Geld 200 c Waare 2
444602,55,200 mm II 1 200 Geld 200 c Waare 2
444626,61,m Waare und da alles Geld was bei diesem Umsatz
444652,64,oder II so ist dies Geld als Element des Umsatzes
444695,55,von II Theil 1 das Geld als Zahlungsmittel fungirt nicht
444743,44,zum Werth von 200 daß Geld hier nur ideell fungirt
444750,61,nur ideell fungirt und kein Geld zur Zahlung von Bilanz
444831,20,Waare ra II 1 200 Geld 2 200 Waare cc
444845,36,Theil 1 kauft mit 200 Geld die Bestandtheile seines fixen
444890,34,in Geldform verwandelt Mit diesem Geld kauft I Konsumtionsmittel von
444933,34,von fixem Kapital ersetzt in Geld niedergeschlagen und dies dauert
444967,39,seinem ganzen Werth nach in Geld rückverwandelt und daher jedes
445018,30,Produktion er wirkt zunächst in Geld zu ersetzen ist Ein
445126,20,m II 1 220 in Geld 2 200 in Waare
445138,36,kauft IIC 1 mit 200 Geld die Waaren 200 I
445149,52,I kauft mit m demselben Geld die Waaren 200 IIC
445163,65,des fixen Kapitals der in Geld niederzuschlagen ist dieser ist
445175,79,Aber 20 IIC 1 in Geld ist nicht rückverwandelbar in
445226,61,m II 1 220 in Geld 2 200 in Waare
445238,71,Theil 1 kauft mit 220 Geld die 220 I und
445260,76,Aber dann bleiben 20 in Geld auf Seite von I
445272,88,Mehrwerth das es nur in Geld festhalten nicht in Konsumtionsmitteln
445318,71,m II 1 180c in Geld 2 200 in Waare
445330,80,Theil 1 kauft für 180 Geld Waaren 180 I I
445339,97,I kauft mit diesem m Geld Waaren zum gleichen Werth
445377,82,Werth von 40 unverwandelbar in Geld Es würde uns nichts
445413,71,Theil 2 unverkaufbar nicht in Geld verwandelbar Im ersten Fall
445434,74,IIC 1 ein Ueberschuß in Geld nicht rückverwandelbar in fixes
445452,80,gesetzt wird derselbe Ueberschuß in Geld auf Seite m von
445477,80,2 bleibt ein Deficit in Geld auf Seite von 200
445508,74,wird ein Deficit in m Geld und Ueberschuß in Waare
445589,20,zu werden von I als Geld aufgehäuft würde im zweiten
445602,36,abzuhelfen wenn I selbst das Geld ausgäbe also die von
445798,20,zu seinem Todestermin einstweilen in Geld zu ersetzen ist in
445948,20,strömt also an I mehr Geld zu außer dem zwischen
445960,35,II zum bloßen Waarenumsatz cirkulirenden Geld mehr Geld das nicht
445962,55,bloßen Waarenumsatz cirkulirenden Geld mehr Geld das nicht wechselseitigen Waarenumsatz
446005,52,von I sondern nur gegen Geld von I umgesetzt werden
446014,66,werden muß Es wäre mehr Geld von II an I
446215,20,Verhältniß der nur noch in Geld zu ersetzende Bestandtheil des
446744,20,als Geldmaterial und daher potentialiter Geld Als Geldmaterial nehmen wir
447174,20,Quotum des im Lande vorräthigen Gelds Die Arbeiter beziehn für
447190,30,und dies kauft mit diesem Geld Produktionsmittel von I Sage
447218,39,zu den Goldproducenten I in Geld das der Cirkulation schon
447244,48,indem es sein Gold als Geld in die Cirkulation wirft
447322,20,dies kauft für 5 in Geld Garn von I und
447332,37,so fließt 5V zurück in Geld an den Garnspinner In
447354,48,5V an seine Arbeiter in Geld vor das schon früher
447365,62,Cirkulation angehörte diese geben das Geld aus in Lebensmitteln es
447637,20,zen ist so muß dies Geld ganz aus IIC übertragen
447733,20,andre dies Kapital beständig in Geld zum Ankauf der Arbeit
447832,20,aber worin ihm das als Geld vorgeschoßne nicht von II
447856,32,und nicht an I retournirtes Geld in Schatz verwandelt und
447914,20,des von Ig in auszulegenden Geldes stets Theil der vor
448013,20,Element der Schatzbildung als in Geld verharrender Theil von II
448116,20,des durch Verschleiß des cirkulirenden Geldes verloren gehenden Goldes Es
448187,20,möglich daß jeder Kapitalist in Geld einen Mehrwerth aus dem
448198,37,Produkt herauszieht d h mehr Geld herauszieht aus der Cirkulation
448222,47,werden muß die überhaupt das Geld in die Cirkulation wirft
448275,35,hier erforderliche Voraussetzung daß überhaupt Geld genug vorhanden sei um
448352,20,Fällen nur Wo kommt das Geld her um diesen Gesammtwaarenwerth
448365,36,keiner Weise Wo kommt das Geld zur Versilberung des Mehrwerths
448430,20,die ganze Klasse ist das Geld worin sie Kapital vorschießt
448438,37,Kapital vorschießt verschieden von dem Geld worin sie Revenue verausgabt
448447,54,verausgabt Woher kommt dies letztre Geld Einfach daher daß von
448492,49,neues Geschäft einrichtende Kapitalist das Geld das er zu seiner
448510,58,zur Versilberung seines Mehrwerths dienendes Geld sobald das Geschäft einmal
448574,31,aber wir sehn nie das Geld als Form der Revenue
448586,46,Hand wir sehn ihn nie Geld zum Verzehr des Mehrwerths
